"1";"Szczytno";"gmina do 20 tyś.";"281706";"Reeve";"KOMITET WYBORCZY WYBORCÓW DOBRO WSPÓLNE";"DEL-7503-188/10";"wyborczy";"1";"Rosa";"Romuald";"M";"55";"Średnie";;;"281706";"Szczytno";"Dębówko";;"N";"464";"9,92"
"1";"Markusy";"gmina do 20 tyś.";"280404";"Reeve";"KOMITET WYBORCZY WYBORCÓW ""DOBRA PRZYSZŁOŚĆ""";"DEL-7503-167/10";"wyborczy w gminie do 20 tys.";"2";"Orzech";"Dariusz";"M";"41";"wyższe";;;"286101";"Elbląg";"Elbląg";;"N";"334";"21,13"
"1";"Markusy";"gmina do 20 tyś.";"280404";"Reeve";"KOMITET WYBORCZY WYBORCÓW DEMOKRATYCZNY ELBLĄG";"DEL-7503-232/10";"wyborczy";"1";"Łysy";"Bożena Jolanta";"K";"60";"wyższe";;;"286101";"Elbląg";"Elbląg";;"N";"181";"11,45"
"1";"Górowo Iławeckie";"gmina do 20 tyś.";"280102";"Mayor";"KOMITET WYBORCZY SOJUSZ LEWICY DEMOKRATYCZNEJ";"ZPOW-7500-8/10";"partia";"2";"Bubeła";"Jerzy";"M";"54";"wyższe";;;"280102";"Górowo Iławeckie";"Górowo Iławeckie";;"N";"550";"24,83"
"1";"Górowo Iławeckie";"gmina do 20 tyś.";"280105";"Reeve";"KOMITET WYBORCZY SOJUSZ LEWICY DEMOKRATYCZNEJ";"ZPOW-7500-8/10";"partia";"2";"Janik";"Bożena";"K";"44";"wyższe pedagogiczne";;;"280105";"Górowo Iławeckie";"Kamińsk";;"N";"240";"6,99"
"1";"Korsze";"gmina do 20 tyś.";"280804";"Mayor";"KOMITET WYBORCZY WYBORCÓW ""POROZUMIENIE DLA DALSZEGO ROZWOJU GMINY KORSZE""";"DOL-7503-109/10";"wyborczy w gminie do 20 tys.";"3";"Ostrowski";"Ryszard";"M";"49";"wyższe";;;"280804";"Korsze";"Korsze";;"T";"3055";"80,82"
"1";"Gietrzwałd";"gmina do 20 tyś.";"281405";"Reeve";"KOMITET WYBORCZY ""DOBRY SAMORZĄD MIAST I GMIN OLSZTYŃSKICH""";"DOL-7502-4/10";"organizacja";"4";"Ziółkowski";"Mieczysław Wiesław";"M";"60";"wyższe";;;"286201";"Olsztyn";"Olsztyn";"złożył następujące oświadczenie: byłem współpracownikiem organów bezpieczeństwa państwa w rozumieniu ustawy z dnia ustawy z dnia 18 października 2006 r. o ujawnianiu informacji o dokumentach organów bezpieczeństwa państwa z lat 1944-1990 oraz treści tych dokumentów (Dz. U z 2007 r. Nr 63, poz. 425, z późn. zm.)";"2";"824";"38,54"
"1";"Markusy";"gmina do 20 tyś.";"280404";"Reeve";"KOMITET WYBORCZY WYBORCÓW ""NASZA GMINA MARKUSY""";"DEL-7503-156/10";"wyborczy w gminie do 20 tys.";"3";"Wielesik";"Wacław";"M";"52";"wyższe";;;"280404";"Markusy";"Stalewo";;"T";"1066";"67,43"
"1";"Lelkowo";"gmina do 20 tyś.";"280204";"Reeve";"KOMITET WYBORCZY PLATFORMA OBYWATELSKA RP";"ZPOW-7500-10/10";"partia";"2";"Skuratko";"Grażyna";"K";"53";"wyższe";;;"280204";"Lelkowo";"Zagaje";;"N";"420";"27,65"
"1";"Kętrzyn";"gmina pow. 20 tyś.";"280801";"Mayor";"KOMITET WYBORCZY PRAWO I SPRAWIEDLIWOŚĆ";"ZPOW-7500-12/10";"partia";"5";"Rypina";"Rafał";"M";"33";"wyższe";"członek Prawa i Sprawiedliwości";;"280801";"Kętrzyn";"Kętrzyn";;"N";"721";"6,67"
"1";"Sorkwity";"gmina do 20 tyś.";"281005";"Reeve";"KOMITET WYBORCZY WYBORCÓW TOMASZA DOMIN";"DOL-7503-122/10";"wyborczy w gminie do 20 tys.";"1";"Domin";"Tomasz Jarosław";"M";"43";"Średnie";;;"281005";"Sorkwity";"Sorkwity";;"N";"445";"18,01"
"1";"Sorkwity";"gmina do 20 tyś.";"281005";"Reeve";"KOMITET WYBORCZY POLSKIE STRONNICTWO LUDOWE";"ZPOW-7500-4/10";"partia";"2";"Dymkowski";"Radosław Ryszard";"M";"28";"Wyższe techniczne";"członek Polskiego Stronnictwa Ludowego";;"281402";"Biskupiec";"Biskupiec";;"N";"257";"10,40"
"1";"Stawiguda";"gmina do 20 tyś.";"281411";"Reeve";"KOMITET WYBORCZY PLATFORMA OBYWATELSKA RP";"ZPOW-7500-10/10";"partia";"2";"Różański";"Piotr";"M";"35";"Wyższe";"członek Platformy Obywatelskiej Rzeczypospolitej Polskiej";;"281411";"Stawiguda";"Pluski";;"2";"825";"31,60"
"1";"Milejewo";"gmina do 20 tyś.";"280405";"Reeve";"KOMITET WYBORCZY WYBORCÓW WSPÓLNE JUTRO";"DEL-7503-48/10";"wyborczy w gminie do 20 tys.";"1";"Janusz";"Ryszard";"M";"54";"wyższe";;;"286101";"Elbląg";"Elbląg";;"T";"1038";"67,89"
"1";"Stawiguda";"gmina do 20 tyś.";"281411";"Reeve";"KOMITET WYBORCZY WYBORCÓW PRZYJACIELE GMINY STAWIGUDA";"DOL-7503-212/10";"wyborczy w gminie do 20 tys.";"3";"Wojnicz";"Tadeusz Zdzisław";"M";"54";"Wyższe";;;"281411";"Stawiguda";"Stawiguda";;"N";"493";"18,88"
"1";"Braniewo";"gmina do 20 tyś.";"280201";"Mayor";"KOMITET WYBORCZY PLATFORMA OBYWATELSKA RP";"ZPOW-7500-10/10";"partia";"3";"Turczyn";"Bożena Ewa";"K";"48";"wyższe";;;"280201";"Braniewo";"Braniewo";;"N";"2178";"28,52"
"1";"Pieniężno";"gmina do 20 tyś.";"280205";"Mayor";"KOMITET WYBORCZY WYBORCÓW NOWE MIASTO I GMINA ""PIENIĘŻNO""";"DEL-7503-169/10";"wyborczy w gminie do 20 tys.";"3";"Kądziołka";"Krzysztof Kamil";"M";"41";"wyższe";;;"280205";"Pieniężno";"Pieniężno";;"2";"586";"18,69"
"1";"Pieniężno";"gmina do 20 tyś.";"280205";"Mayor";"KOMITET WYBORCZY WYBORCÓW ""NASZ DOM GMINA PIENIĘŻNO""";"DEL-7503-237/10";"wyborczy w gminie do 20 tys.";"4";"Kiejdo";"Kazimierz";"M";"51";"wyższe";;;"280205";"Pieniężno";"Pieniężno";;"2";"1305";"41,63"
"1";"Iłowo-Osada";"gmina do 20 tyś.";"280303";"Reeve";"KOMITET WYBORCZY WYBORCÓW ""NASZA GMINA JANA PRZYBORSKIEGO""";"DEL-7503-24/10";"wyborczy w gminie do 20 tys.";"1";"Przyborski";"Jan Zygmunt";"M";"59";"średnie";"członek Sojuszu Lewicy Demokratycznej";;"280303";"Iłowo-Osada";"Narzym";;"2";"1556";"46,53"
"1";"Pieniężno";"gmina do 20 tyś.";"280205";"Mayor";"KOMITET WYBORCZY WYBORCÓW MIASTO I GMINA-RAZEM DLA PRZYSZŁOŚCI";"DEL-7503-211/10";"wyborczy w gminie do 20 tys.";"6";"Smykowski";"Jarosław";"M";"51";"wyższe";;;"280201";"Braniewo";"Braniewo";;"N";"136";"4,34"
"1";"Górowo Iławeckie";"gmina do 20 tyś.";"280102";"Mayor";"KOMITET WYBORCZY GÓROWSKA MAŁA OJCZYZNA";"DEL-7503-108/10";"organizacja";"1";"Błocki";"Grzegorz";"M";"38";"średnie";;;"280102";"Górowo Iławeckie";"Górowo Iławeckie";;"N";"471";"21,26"
"1";"Górowo Iławeckie";"gmina do 20 tyś.";"280102";"Mayor";"KOMITET WYBORCZY WYBORCÓW OBYWATELE";"DEL-7503-76/10";"wyborczy";"3";"Kostka";"Jacek Przemysław";"M";"38";"wyższe";;;"280102";"Górowo Iławeckie";"Górowo Iławeckie";;"T";"1194";"53,91"
"1";"Pisz";"gmina pow. 20 tyś.";"281603";"Mayor";"KOMITET WYBORCZY PLATFORMA OBYWATELSKA RP";"ZPOW-7500-10/10";"partia";"5";"Zarzecki";"Jacek";"M";"30";"średnie";"członek Platformy Obywatelskiej Rzeczypospolitej Polskiej";;"281603";"Pisz";"Pisz";;"N";"721";"5,94"
"1";"Pisz";"gmina pow. 20 tyś.";"281603";"Mayor";"KOMITET WYBORCZY WYBORCÓW FORUM SAMORZĄDOWE POWIATU PISKIEGO";"DOL-7503-3/10";"wyborczy";"4";"Szymborski";"Andrzej Janusz";"M";"52";"średnie";;;"281603";"Pisz";"Pisz";;"N";"1691";"13,93"
"1";"Braniewo";"gmina do 20 tyś.";"280201";"Mayor";"KOMITET WYBORCZY WYBORCÓW ""WSPÓLNE BRANIEWO""";"DEL-7503-25/10";"wyborczy w gminie do 20 tys.";"2";"Penkalski";"Wojciech Adam";"M";"36";"Wyższe";;;"280201";"Braniewo";"Braniewo";;"N";"380";"4,98"
"1";"Sorkwity";"gmina do 20 tyś.";"281005";"Reeve";"KOMITET WYBORCZY WYBORCÓW JÓZEFA MACIEJEWSKIEGO";"DOL-7503-143/10";"wyborczy w gminie do 20 tys.";"3";"Maciejewski";"Józef";"M";"53";"Wyższe";;;"281005";"Sorkwity";"Stary Gieląd";;"2";"750";"30,35"
"1";"Miłakowo";"gmina do 20 tyś.";"281506";"Mayor";"KOMITET WYBORCZY PLATFORMA OBYWATELSKA RP";"ZPOW-7500-10/10";"partia";"2";"Maciura";"Kazimierz";"M";"42";"wyższe";"członek Platformy Obywatelskiej Rzeczypospolitej Polskiej";"popierany przez Platformę Obywatelską Rzeczypospolitej Polskiej";"281506";"Miłakowo";"Miłakowo";;"N";"189";"8,65"
"1";"Pieniężno";"gmina do 20 tyś.";"280205";"Mayor";"KOMITET WYBORCZY LISTA ZIEMI BRANIEWSKIEJ";"DEL-7503-14/10";"organizacja";"2";"Byczuk";"Ewa";"K";"48";"wyższe";;;"280205";"Pieniężno";"Pieniężno";;"N";"448";"14,29"
"1";"Lidzbark";"gmina do 20 tyś.";"280304";"Mayor";"KOMITET WYBORCZY WYBORCÓW BLOK BEZPARTYJNO - LUDOWY";"DEL-7503-177/10";"wyborczy";"3";"Rogowski";"Jan";"M";"69";"Wyższe";;;"280304";"Lidzbark";"Lidzbark";;"T";"4013";"71,09"
"1";"Pieniężno";"gmina do 20 tyś.";"280205";"Mayor";"KOMITET WYBORCZY WYBORCÓW ALINA MAŃKUT";"DEL-7503-11/10";"wyborczy w gminie do 20 tys.";"5";"Mańkut";"Alina Bożena";"K";"52";"wyższe";;;"280205";"Pieniężno";"Pieniężno";;"N";"467";"14,90"
"1";"Prostki";"gmina do 20 tyś.";"280504";"Reeve";"KOMITET WYBORCZY PRAWO I SPRAWIEDLIWOŚĆ";"ZPOW-7500-12/10";"partia";"3";"Kacperski";"Grzegorz";"M";"31";"wyższe";"członek Prawa i Sprawiedliwości";"popierany przez Prawo i Sprawiedliwość";"280504";"Prostki";"Prostki";;"N";"563";"19,42"
"1";"Pisz";"gmina pow. 20 tyś.";"281603";"Mayor";"KOMITET WYBORCZY WYBORCÓW ZENONA BEDNARCZYKA";"DOL-7503-35/10";"wyborczy";"2";"Bednarczyk";"Zenon";"M";"41";"wyższe";;;"281603";"Pisz";"Pisz";;"N";"785";"6,47"
"1";"Pieniężno";"gmina do 20 tyś.";"280205";"Mayor";"KOMITET WYBORCZY WYBORCÓW POROZUMIENIE SAMORZĄDOWE";"DEL-7503-30/10";"wyborczy";"1";"Bieniuk";"Krzysztof";"M";"45";"średnie";;;"280205";"Pieniężno";"Łajsy";;"N";"193";"6,16"
"1";"Giżycko";"gmina do 20 tyś.";"280604";"Reeve";"KOMITET WYBORCZY POLSKIE STRONNICTWO LUDOWE";"ZPOW-7500-4/10";"partia";"3";"Należyty";"Ryszard Piotr";"M";"51";"wyższe";"członek Polskiego Stronnictwa Ludowego";;"280604";"Giżycko";"Grajwo";;"N";"514";"16,71"
"1";"Pozezdrze";"gmina do 20 tyś.";"281902";"Reeve";"KOMITET WYBORCZY WYBORCÓW GMINA - WSPÓLNE DOBRO";"DOL-7503-172/10";"wyborczy w gminie do 20 tys.";"3";"Supranowicz";"Marzenna Jolanta";"K";"47";"średnie";;;"281902";"Pozezdrze";"Radziszewo";;"2";"681";"43,88"
"1";"Budry";"gmina do 20 tyś.";"281901";"Reeve";"KOMITET WYBORCZY WYBORCÓW MAREK MYKA";"DOL-7503-28/10";"wyborczy w gminie do 20 tys.";"3";"Myka";"Marek Jan";"M";"40";"wyższe";;;"281901";"Budry";"Olszewo Węgorzewskie";;"N";"453";"31,09"
"1";"Pozezdrze";"gmina do 20 tyś.";"281902";"Reeve";"KOMITET WYBORCZY WYBORCÓW POTRZEBNE ZMIANY W POZEZDRZU";"DOL-7503-67/10";"wyborczy w gminie do 20 tys.";"2";"Pietrołaj";"Marta";"K";"31";"wyższe";;;"281902";"Pozezdrze";"Pozezdrze";;"N";"90";"5,80"
"1";"Purda";"gmina do 20 tyś.";"281410";"Reeve";"KOMITET WYBORCZY WYBORCÓW WSPÓLNA SPRAWA - GMINA PURDA";"DOL-7503-195/10";"wyborczy w gminie do 20 tys.";"1";"Laskowski";"Jerzy";"M";"51";"wyższe";"członek Sojuszu Lewicy Demokratycznej";;"281410";"Purda";"Butryny";;"T";"1870";"67,44"
"1";"Olecko";"gmina pow. 20 tyś.";"281304";"Mayor";"KOMITET WYBORCZY WYBORCÓW POROZUMIENIE OBYWATELSKIE SZANSA";"DOL-7503-32/10";"wyborczy";"1";"Dzienisiewicz";"Maria Wanda";"K";"45";"wyższe";;;"281304";"Olecko";"Olecko";;"N";"1740";"22,98"
"1";"Braniewo";"gmina do 20 tyś.";"280202";"Reeve";"KOMITET WYBORCZY WYBORCÓW ROMAN";"DEL-7503-258/10";"wyborczy w gminie do 20 tys.";"1";"Niewiadomski";"Roman";"M";"41";"wyższe";;;"280201";"Braniewo";"Braniewo";;"N";"408";"13,78"
"1";"Dobre Miasto";"gmina do 20 tyś.";"281403";"Mayor";"KOMITET WYBORCZY WYBORCÓW NIEZALEŻNI PONAD PODZIAŁAMI";"DOL-7503-39/10";"wyborczy w gminie do 20 tys.";"2";"Trzaskowski";"Stanisław Grzegorz";"M";"60";"wyższe";;;"281403";"Dobre Miasto";"Dobre Miasto";;"T";"3535";"63,88"
"1";"Olsztyn";"miasto na prawach powiatu";"286201";"President";"KOMITET WYBORCZY WYBORCÓW PIOTRA GRZYMOWICZA";"DOL-7503-226/10";"wyborczy";"2";"Grzymowicz";"Piotr Władysław";"M";"56";"wyższe";;;"286201";"Olsztyn";"Olsztyn";;"2";"22136";"36,32"
"1";"Kozłowo";"gmina do 20 tyś.";"281103";"Reeve";"KOMITET WYBORCZY WYBORCÓW AKTYWNI MIESZKAŃCY";"DOL-7503-155/10";"wyborczy w gminie do 20 tys.";"5";"Prażmo";"Maciej Grzegorz";"M";"38";"średnie";;;"281103";"Kozłowo";"Kozłowo";;"N";"154";"5,08"
"1";"Jedwabno";"gmina do 20 tyś.";"281703";"Reeve";"KOMITET WYBORCZY WYBORCÓW CZAS NA GOSPODARZA";"DOL-7503-141/10";"wyborczy w gminie do 20 tys.";"3";"Otulakowski";"Krzysztof Jan";"M";"36";"wyższe";;;"281703";"Jedwabno";"Jedwabno";;"2";"538";"30,06"
"1";"Wydminy";"gmina do 20 tyś.";"280610";"Reeve";"KOMITET WYBORCZY WYBORCÓW ROZWÓJ I ZGODA";"DOL-7503-135/10";"wyborczy w gminie do 20 tys.";"1";"Król";"Radosław";"M";"35";"wyższe";"członek Polskiego Stronnictwa Ludowego";;"286201";"Olsztyn";"Olsztyn";;"T";"1679";"58,34"
"1";"Kozłowo";"gmina do 20 tyś.";"281103";"Reeve";"KOMITET WYBORCZY WYBORCÓW POROZUMIENIE BEZ GRANIC";"DOL-7503-99/10";"wyborczy w gminie do 20 tys.";"2";"Dreger";"Janusz Ryszard";"M";"54";"średnie";;;"281103";"Kozłowo";"Kownatki";;"N";"60";"1,98"
"1";"Młynary";"gmina do 20 tyś.";"280406";"Mayor";"KOMITET WYBORCZY WYBORCÓW MARKA MISZTALA ""DOBRA GMINA""";"DEL-7503-34/10";"wyborczy w gminie do 20 tys.";"2";"Misztal";"Marek Stanisław";"M";"42";"Wyższe";;;"280406";"Młynary";"Młynary";;"2";"803";"36,47"
"1";"Małdyty";"gmina do 20 tyś.";"281505";"Reeve";"KOMITET WYBORCZY WYBORCÓW JAROSŁAWA BAKUNOWICZA";"DEL-7503-170/10";"wyborczy w gminie do 20 tys.";"2";"Bakunowicz";"Jarosław";"M";"41";"wyższe techniczne";;;"281505";"Małdyty";"Małdyty";;"N";"560";"23,32"
"1";"Budry";"gmina do 20 tyś.";"281901";"Reeve";"KOMITET WYBORCZY WYBORCÓW JAN HUBACZ";"DOL-7503-59/10";"wyborczy w gminie do 20 tys.";"1";"Hubacz";"Jan Roman";"M";"44";"wyższe";"członek Samoobrony Rzeczpospolitej Polskiej";;"281901";"Budry";"Budry";;"N";"163";"11,19"
"1";"Kozłowo";"gmina do 20 tyś.";"281103";"Reeve";"KOMITET WYBORCZY WYBORCÓW EWY KRZYŻEWSKIEJ";"DOL-7503-183/10";"wyborczy w gminie do 20 tys.";"4";"Krzyżewska";"Ewa";"K";"49";"wyższe";;;"281103";"Kozłowo";"Kozłowo";;"N";"126";"4,15"
"1";"Małdyty";"gmina do 20 tyś.";"281505";"Reeve";"KOMITET WYBORCZY WYBORCÓW  ANTONIEGO SMOLAKA";"DEL-7503-88/10";"wyborczy w gminie do 20 tys.";"3";"Smolak";"Antoni";"M";"60";"wyższe";;;"281505";"Małdyty";"Małdyty";;"2";"1090";"45,40"
"1";"Świętajno";"gmina do 20 tyś.";"281305";"Reeve";"KOMITET WYBORCZY WYBORCÓW MAŁA OJCZYZNA OLECKO";"DOL-7503-25/10";"wyborczy";"1";"Czochra";"Jarosław Romuald";"M";"51";"średnie";;;"281305";"Świętajno";"Świętajno";;"N";"631";"47,09"
"1";"Jedwabno";"gmina do 20 tyś.";"281703";"Reeve";"KOMITET WYBORCZY WYBORCÓW BOŻENY HARBASZEWSKIEJ";"DOL-7503-146/10";"wyborczy w gminie do 20 tys.";"2";"Harbaszewska";"Bożena";"K";"53";"wyższe";;;"281703";"Jedwabno";"Dłużek";;"N";"319";"17,82"
"1";"Janowiec Kościelny";"gmina do 20 tyś.";"281101";"Reeve";"KOMITET WYBORCZY PRAWO I SPRAWIEDLIWOŚĆ";"ZPOW-7500-12/10";"partia";"1";"Grochala";"Bożena";"K";"56";"wyższe";;;"281101";"Janowiec Kościelny";"Janowiec Kościelny";;"T";"1391";"68,15"
"1";"Młynary";"gmina do 20 tyś.";"280406";"Mayor";"KOMITET WYBORCZY WYBORCÓW NASZE MIASTO I GMINA MŁYNARY";"DEL-7503-36/10";"wyborczy w gminie do 20 tys.";"1";"Łabicki";"Tadeusz";"M";"58";"Wyższe";"członek Prawa i Sprawiedliwości";;"280406";"Młynary";"Młynarska Wola";;"N";"353";"16,03"
"1";"Frombork";"gmina do 20 tyś.";"280203";"Mayor";"KOMITET WYBORCZY WYBORCÓW STRAŻACY";"DEL-7503-31/10";"wyborczy w gminie do 20 tys.";"1";"Lewańska";"Krystyna Ryszarda";"K";"58";"średnie";;;"280203";"Frombork";"Frombork";;"2";"775";"45,70"
"1";"Kiwity";"gmina do 20 tyś.";"280902";"Reeve";"KOMITET WYBORCZY WYBORCÓW ZYGMUNTA BEKIESZCZUKA";"DEL-7503-72/10";"wyborczy w gminie do 20 tys.";"1";"Bekieszczuk";"Zygmunt Józef";"M";"61";"Wyższe";;;"280902";"Kiwity";"Kiwity";;"2";"389";"21,42"
"1";"Banie Mazurskie";"gmina do 20 tyś.";"281801";"Reeve";"KOMITET WYBORCZY WYBORCÓW ""RZETELNOŚĆ I ROZWÓJ""";"DOL-7503-90/10";"wyborczy w gminie do 20 tys.";"2";"Janczewski";"Jan";"M";"56";"wyższe";;;"280604";"Giżycko";"Antonowo";;"N";"182";"9,81"
"1";"Srokowo";"gmina do 20 tyś.";"280806";"Reeve";"KOMITET WYBORCZY WYBORCÓW MIĘDZYGMINNE FORUM SAMORZĄDOWE";"DOL-7503-91/10";"wyborczy";"1";"Andruszkiewicz";"Franciszek";"M";"59";"wyższe";;;"280806";"Srokowo";"Srokowo";;"T";"1301";"75,03"
"1";"Ełk";"gmina pow. 20 tyś.";"280501";"President";"KOMITET WYBORCZY SOJUSZ LEWICY DEMOKRATYCZNEJ";"ZPOW-7500-8/10";"partia";"2";"Czepułkowski";"Jerzy Mieczysław";"M";"58";"wyższe";"członek Sojuszu Lewicy Demokratycznej";;"280501";"Ełk";"Ełk";;"N";"1763";"9,37"
"1";"Frombork";"gmina do 20 tyś.";"280203";"Mayor";"KOMITET WYBORCZY PLATFORMA OBYWATELSKA RP";"ZPOW-7500-10/10";"partia";"3";"Zakrzewska";"Urszula Joanna";"K";"35";"wyższe";;;"280203";"Frombork";"Braniewo";;"N";"380";"22,41"
"1";"Nidzica";"gmina pow. 20 tyś.";"281104";"Mayor";"KOMITET WYBORCZY PRAWO I SPRAWIEDLIWOŚĆ";"ZPOW-7500-12/10";"partia";"3";"Ekiert";"Ludwik Waldemar";"M";"61";"wyższe";"członek Prawa i Sprawiedliwości";;"281104";"Nidzica";"Nidzica";;"N";"1089";"12,49"
"1";"Dąbrówno";"gmina do 20 tyś.";"281502";"Reeve";"KOMITET WYBORCZY WYBORCÓW TADEUSZA BŁASZKIEWICZA";"DEL-7503-101/10";"wyborczy w gminie do 20 tys.";"1";"Błaszkiewicz";"Tadeusz";"M";"59";"średnie";;;"281502";"Dąbrówno";"Dąbrówno";;"T";"1412";"67,95"
"1";"Kozłowo";"gmina do 20 tyś.";"281103";"Reeve";"KOMITET WYBORCZY WYBORCÓW ""MŁODZI""";"DOL-7503-128/10";"wyborczy";"3";"Jankowski";"Jacek";"M";"34";"wyższe";;;"281103";"Kozłowo";"Cebulki";;"T";"2120";"69,87"
"1";"Łukta";"gmina do 20 tyś.";"281504";"Reeve";"KOMITET WYBORCZY WYBORCÓW NASZ DOM GMINA ŁUKTA";"DEL-7503-271/10";"wyborczy w gminie do 20 tys.";"2";"Sekuła";"Grzegorz Leon";"M";"49";"wyższe";;;"281504";"Łukta";"Łukta";;"N";"938";"47,33"
"1";"Świętajno";"gmina do 20 tyś.";"281707";"Reeve";"KOMITET WYBORCZY WYBORCÓW NASZA GMINA - NASZ DOM";"DOL-7503-73/10";"wyborczy w gminie do 20 tys.";"2";"Pabich";"Janusz Sylwester";"M";"40";"wyższe";;;"281707";"Świętajno";"Świętajno";;"T";"1251";"55,90"
"1";"Świętajno";"gmina do 20 tyś.";"281707";"Reeve";"KOMITET WYBORCZY PLATFORMA OBYWATELSKA RP";"ZPOW-7500-10/10";"partia";"1";"Kołakowska";"Alicja";"K";"43";"wyższe";"członek Platformy Obywatelskiej Rzeczypospolitej Polskiej";;"281707";"Świętajno";"Piasutno";;"N";"987";"44,10"
"1";"Frombork";"gmina do 20 tyś.";"280203";"Mayor";"KOMITET WYBORCZY WYBORCÓW ""PRZEMIANY""";"DEL-7503-127/10";"wyborczy w gminie do 20 tys.";"2";"Wrońska";"Małgorzata Marta";"K";"29";"wyższe";;;"280203";"Frombork";"Frombork";;"2";"541";"31,90"
"1";"Kolno";"gmina do 20 tyś.";"281408";"Reeve";"KOMITET WYBORCZY WYBORCÓW JUSTYNA ŁUKASZEWICZ";"DOL-7503-255/10";"wyborczy w gminie do 20 tys.";"3";"Łukaszewicz";"Justyna Małgorzata";"K";"28";"Średnie";;;"281408";"Kolno";"Bęsia";;"N";"131";"9,15"
"1";"Kolno";"gmina do 20 tyś.";"281408";"Reeve";"KOMITET WYBORCZY ""DOBRY SAMORZĄD MIAST I GMIN OLSZTYŃSKICH""";"DOL-7502-4/10";"organizacja";"2";"Duda";"Henryk Kazimierz";"M";"55";"średnie";;;"281408";"Kolno";"Lutry";;"T";"1073";"74,93"
"1";"Kruklanki";"gmina do 20 tyś.";"280605";"Reeve";"KOMITET WYBORCZY PRAWO I SPRAWIEDLIWOŚĆ";"ZPOW-7500-12/10";"partia";"4";"Szostak";"Izabela Kamila";"K";"34";"Wyższe";;;"280605";"Kruklanki";"Kruklanki";;"N";"136";"10,37"
"1";"Kruklanki";"gmina do 20 tyś.";"280605";"Reeve";"KOMITET WYBORCZY SOJUSZ LEWICY DEMOKRATYCZNEJ";"ZPOW-7500-8/10";"partia";"2";"Gładkowski";"Władysław";"M";"60";"średnie";"członek Sojuszu Lewicy Demokratycznej";;"280605";"Kruklanki";"Kruklanki";;"2";"518";"39,51"
"1";"Kruklanki";"gmina do 20 tyś.";"280605";"Reeve";"KOMITET WYBORCZY WYBORCÓW NASZE KRUKLANKI";"DOL-7503-72/10";"wyborczy w gminie do 20 tys.";"3";"Przyłucki";"Edward";"M";"54";"średnie";;;"280605";"Kruklanki";"Brożówka";;"2";"535";"40,81"
"1";"Kruklanki";"gmina do 20 tyś.";"280605";"Reeve";"KOMITET WYBORCZY WYBORCÓW RAZEM W PRZYSZŁOŚĆ KRUKLANKI";"DOL-7503-204/10";"wyborczy w gminie do 20 tys.";"1";"Całka";"Adam Robert";"M";"37";"Wyższe";;;"280605";"Kruklanki";"Kruklanki";;"N";"122";"9,31"
"1";"Sępopol";"gmina do 20 tyś.";"280106";"Mayor";"KOMITET WYBORCZY WYBORCÓW ""NIEZALEŻNI-AKTYWNI""";"DEL-7503-152/10";"wyborczy w gminie do 20 tys.";"3";"Piorun";"Krzysztof";"M";"37";"wyższe";;;"280106";"Sępopol";"Sępopol";;"N";"270";"9,84"
"1";"Olsztyn";"miasto na prawach powiatu";"286201";"President";"KOMITET WYBORCZY WYBORCÓW ZIELONY OLSZTYN - MŁODZI SOCJALIŚCI";"DOL-7503-225/10";"wyborczy";"6";"Prątkowski";"Ryszard";"M";"58";"wyższe";;;"286201";"Olsztyn";"Olsztyn";;"N";"391";"0,64"
"1";"Prostki";"gmina do 20 tyś.";"280504";"Reeve";"KOMITET WYBORCZY WYBORCÓW AKTYWNA GMINA PROSTKI";"DOL-7503-38/10";"wyborczy w gminie do 20 tys.";"1";"Bagan";"Bożena Waleria";"K";"56";"wyższe";;;"280504";"Prostki";"Prostki";;"2";"803";"27,70"
"1";"Lidzbark Warmiński";"gmina do 20 tyś.";"280903";"Reeve";"KOMITET WYBORCZY POLSKIE STRONNICTWO LUDOWE";"ZPOW-7500-4/10";"partia";"3";"Łazowski";"Piotr";"M";"44";"Wyższe";;;"280903";"Lidzbark Warmiński";"Lidzbark Warmiński";;"N";"138";"4,93"
"1";"Barciany";"gmina do 20 tyś.";"280802";"Reeve";"KOMITET WYBORCZY WYBORCÓW ""RAZEM DLA ZIEMI KĘTRZYŃSKIEJ""";"DOL-7503-185/10";"wyborczy";"3";"Przybyliński";"Ryszard";"M";"49";"wyższe";;;"280801";"Kętrzyn";"Kętrzyn";;"N";"56";"1,92"
"1";"Nowe Miasto Lubawskie";"gmina do 20 tyś.";"281205";"Reeve";"KOMITET WYBORCZY WYBORCÓW CEZAREGO KAWIECKIEGO";"DEL-7503-61/10";"wyborczy w gminie do 20 tys.";"2";"Kawiecki";"Cezary Jacek";"M";"45";"wyższe";;;"281205";"Nowe Miasto Lubawskie";"Pacółtowo";;"N";"855";"26,41"
"1";"Kętrzyn";"gmina do 20 tyś.";"280803";"Reeve";"KOMITET WYBORCZY WYBORCÓW ANDRZEJA CYBULSKIEGO";"DOL-7503-162/10";"wyborczy w gminie do 20 tys.";"1";"Cybulski";"Andrzej";"M";"56";"wyższe prawnicze";;;"280801";"Kętrzyn";"Kętrzyn";;"N";"235";"7,74"
"1";"Kozłowo";"gmina do 20 tyś.";"281103";"Reeve";"KOMITET WYBORCZY WYBORCÓW KOZŁOWO WSPÓLNA GMINA";"DOL-7503-86/10";"wyborczy w gminie do 20 tys.";"1";"Borkowski";"Jan";"M";"49";"średnie";;;"281103";"Kozłowo";"Kozłowo";;"N";"574";"18,92"
"1";"Kiwity";"gmina do 20 tyś.";"280902";"Reeve";"KOMITET WYBORCZY WYBORCÓW WARMIA NASZA MAŁA OJCZYZNA";"DEL-7503-12/10";"wyborczy";"2";"Chudycz";"Piotr Przemysław";"M";"33";"Średnie";"członek Platformy Obywatelskiej Rzeczypospolitej Polskiej";;"280902";"Kiwity";"Klutajny";;"N";"344";"18,94"
"1";"Braniewo";"gmina do 20 tyś.";"280202";"Reeve";"KOMITET WYBORCZY SOJUSZ LEWICY DEMOKRATYCZNEJ";"ZPOW-7500-8/10";"partia";"2";"Przyborowski";"Wincenty Marian";"M";"63";"średnie - policealne";"członek Sojuszu Lewicy Demokratycznej";"popierany przez Sojusz Lewicy Demokratycznej";"280201";"Braniewo";"Braniewo";;"2";"802";"27,09"
"1";"Braniewo";"gmina do 20 tyś.";"280202";"Reeve";"KOMITET WYBORCZY WYBORCÓW SOKÓŁ";"DEL-7503-128/10";"wyborczy w gminie do 20 tys.";"4";"Sokołowski";"Janusz";"M";"58";"wyższe";;;"280201";"Braniewo";"Braniewo";;"N";"458";"15,47"
"1";"Biała Piska";"gmina do 20 tyś.";"281601";"Mayor";"KOMITET WYBORCZY WYBORCÓW FORUM SAMORZĄDOWE POWIATU PISKIEGO";"DOL-7503-3/10";"wyborczy";"3";"Sobolewski";"Adam Kazimierz";"M";"48";"wyższe magisterskie";;;"281601";"Biała Piska";"Biała Piska";;"N";"227";"4,17"
"1";"Biała Piska";"gmina do 20 tyś.";"281601";"Mayor";"KOMITET WYBORCZY POLSKIE STRONNICTWO LUDOWE";"ZPOW-7500-4/10";"partia";"2";"Kurzątkowski";"Andrzej";"M";"45";"średnie";"członek Polskiego Stronnictwa Ludowego";;"281601";"Biała Piska";"Kózki";;"N";"1453";"26,70"
"1";"Iława";"gmina do 20 tyś.";"280703";"Reeve";"KOMITET WYBORCZY WYBORCÓW WSPÓLNA GMINA";"DEL-7503-1/10";"wyborczy w gminie do 20 tys.";"1";"Harmaciński";"Krzysztof";"M";"52";"wyższe";;;"280701";"Iława";"Iława";;"T";"2655";"63,06"
"1";"Lidzbark Warmiński";"gmina do 20 tyś.";"280903";"Reeve";"KOMITET WYBORCZY WYBORCÓW WARMIA NASZA MAŁA OJCZYZNA";"DEL-7503-12/10";"wyborczy";"1";"Jankowski";"Artur Mariusz";"M";"37";"Wyższe";;;"280903";"Lidzbark Warmiński";"Wielochowo";;"T";"2096";"74,94"
"1";"Giżycko";"gmina pow. 20 tyś.";"280601";"Mayor";"KOMITET WYBORCZY WYBORCÓW RAZEM GIŻYCKO";"DOL-7503-14/10";"wyborczy";"6";"Piotrowska";"Jolanta";"K";"49";"wyższe";"członek Platformy Obywatelskiej Rzeczypospolitej Polskiej";;"280601";"Giżycko";"Giżycko";;"T";"5967";"57,07"
"1";"Orneta";"gmina do 20 tyś.";"280905";"Mayor";"KOMITET WYBORCZY WYBORCÓW POROZUMIENIE NIEZALEŻNYCH";"DEL-7503-13/10";"wyborczy";"3";"Popiel";"Ireneusz";"M";"38";"wyższe";;;"280905";"Orneta";"Orneta";;"2";"2490";"46,68"
"1";"Orneta";"gmina do 20 tyś.";"280905";"Mayor";"KOMITET WYBORCZY WYBORCÓW WARMIA NASZA MAŁA OJCZYZNA";"DEL-7503-12/10";"wyborczy";"1";"Kogut";"Jarosław";"M";"50";"wyższe";;;"280905";"Orneta";"Orneta";;"2";"1886";"35,36"
"1";"Sępopol";"gmina do 20 tyś.";"280106";"Mayor";"KOMITET WYBORCZY WYBORCÓW ""BLOK DLA ZIEMI SĘPOPOLSKIEJ""";"DEL-7503-102/10";"wyborczy w gminie do 20 tys.";"2";"Mucha";"Grzegorz";"M";"42";"wyższe";;;"280106";"Sępopol";"Sępopol";;"2";"1207";"44,00"
"1";"Miłomłyn";"gmina do 20 tyś.";"281507";"Mayor";"KOMITET WYBORCZY WYBORCÓW BEATY MAZUR";"DEL-7503-33/10";"wyborczy w gminie do 20 tys.";"2";"Mazur";"Beata Ewa";"K";"46";"wyższe";;;"281507";"Miłomłyn";"Miłomłyn";;"2";"653";"29,48"
"1";"Olsztyn";"miasto na prawach powiatu";"286201";"President";"KOMITET WYBORCZY WYBORCÓW CZESŁAWA JERZEGO MAŁKOWSKIEGO";"DOL-7503-228/10";"wyborczy";"5";"Małkowski";"Czesław Jerzy";"M";"60";"wyższe";;;"286201";"Olsztyn";"Olsztyn";;"2";"23565";"38,66"
