"1";"Susz";"gmina do 20 tyś.";"280706";"Mayor";"KOMITET WYBORCZY WYBORCÓW FORUM SAMORZĄDOWE SUSZ";"DEL-7503-172/10";"wyborczy w gminie do 20 tys.";"2";"Sadowski";"Jan Adam";"M";"61";"wyższe";;;"280706";"Susz";"Susz";;"N";"2359";"40,64"
"1";"Lelkowo";"gmina do 20 tyś.";"280204";"Reeve";"KOMITET WYBORCZY WYBORCÓW NASZ SAMORZĄD";"DEL-7503-69/10";"wyborczy";"1";"Popiel";"Stanisław";"M";"50";"wyższe";;;"280204";"Lelkowo";"Lelkowo";;"T";"1099";"72,35"
"1";"Ryn";"gmina do 20 tyś.";"280608";"Mayor";"KOMITET WYBORCZY PRAWO I SPRAWIEDLIWOŚĆ";"ZPOW-7500-12/10";"partia";"3";"Kaniuka";"Stanisław";"M";"57";"wyższe";;;"281701";"Szczytno";"Szczytno";;"N";"96";"4,11"
"1";"Braniewo";"gmina do 20 tyś.";"280202";"Reeve";"KOMITET WYBORCZY LISTA ZIEMI BRANIEWSKIEJ";"DEL-7503-14/10";"organizacja";"5";"Wabińska";"Wioletta Agnieszka";"K";"36";"wyższe";;;"280202";"Braniewo";"Podleśne";;"N";"621";"20,98"
"1";"Barciany";"gmina do 20 tyś.";"280802";"Reeve";"KOMITET WYBORCZY WYBORCÓW MIĘDZYGMINNE FORUM SAMORZĄDOWE";"DOL-7503-91/10";"wyborczy";"1";"Bogdanowicz";"Witold";"M";"47";"wyższe";;;"280802";"Barciany";"Skandawa";;"N";"506";"17,33"
"1";"Ełk";"gmina pow. 20 tyś.";"280501";"President";"KOMITET WYBORCZY PLATFORMA OBYWATELSKA RP";"ZPOW-7500-10/10";"partia";"7";"Szelążek";"Włodzimierz";"M";"53";"wyższe";"członek Platformy Obywatelskiej Rzeczypospolitej Polskiej";;"280501";"Ełk";"Ełk";;"N";"1023";"5,44"
"1";"Sorkwity";"gmina do 20 tyś.";"281005";"Reeve";"KOMITET WYBORCZY PRAWO I SPRAWIEDLIWOŚĆ";"ZPOW-7500-12/10";"partia";"4";"Onisiewicz";"Anna";"K";"42";"wyższe";"członek Prawa i Sprawiedliwości";;"281005";"Sorkwity";"Stary Gieląd";;"N";"53";"2,14"
"1";"Giżycko";"gmina do 20 tyś.";"280604";"Reeve";"KOMITET WYBORCZY WYBORCÓW SAMORZĄDNI GMINY GIŻYCKO";"DOL-7503-74/10";"wyborczy w gminie do 20 tys.";"2";"Dworak";"Mirosław Marek";"M";"47";"wyższe";;;"280604";"Giżycko";"Spytkowo";;"N";"211";"6,86"
"1";"Braniewo";"gmina do 20 tyś.";"280202";"Reeve";"KOMITET WYBORCZY WYBORCÓW POROZUMIENIE SAMORZĄDOWE";"DEL-7503-30/10";"wyborczy";"3";"Sielicki";"Tomasz";"M";"36";"Wyższe";"członek Polskiego Stronnictwa Ludowego";;"280202";"Braniewo";"Szyleny";;"2";"671";"22,67"
"1";"Pozezdrze";"gmina do 20 tyś.";"281902";"Reeve";"KOMITET WYBORCZY WYBORCÓW PONAD PODZIAŁAMI W WĘGORZEWIE";"DOL-7503-69/10";"wyborczy";"1";"Nowacki";"Robert Krzysztof";"M";"32";"wyższe";"członek Prawa i Sprawiedliwości";;"281902";"Pozezdrze";"Stręgielek";;"2";"519";"33,44"
"1";"Giżycko";"gmina pow. 20 tyś.";"280601";"Mayor";"KOMITET WYBORCZY PRAWO I SPRAWIEDLIWOŚĆ";"ZPOW-7500-12/10";"partia";"4";"Kunda";"Jerzy";"M";"51";"wyższe";"członek Prawa i Sprawiedliwości";;"280601";"Giżycko";"Giżycko";;"N";"574";"5,49"
"1";"Kętrzyn";"gmina do 20 tyś.";"280803";"Reeve";"KOMITET WYBORCZY WYBORCÓW MIĘDZYGMINNE FORUM SAMORZĄDOWE";"DOL-7503-91/10";"wyborczy";"2";"Jarosik";"Sławomir Marek";"M";"49";"wyższe";;;"280803";"Kętrzyn";"Karolewo";;"T";"1779";"58,58"
"1";"Giżycko";"gmina do 20 tyś.";"280604";"Reeve";"KOMITET WYBORCZY PRAWO I SPRAWIEDLIWOŚĆ";"ZPOW-7500-12/10";"partia";"1";"Ćwikowski";"Paweł";"M";"32";"wyższe";"członek Prawa i Sprawiedliwości";;"280604";"Giżycko";"Wilkasy";;"N";"484";"15,73"
"1";"Ełk";"gmina do 20 tyś.";"280502";"Reeve";"KOMITET WYBORCZY WYBORCÓW KRZYSZTOFA PIŁATA";"DOL-7503-131/10";"wyborczy w gminie do 20 tys.";"2";"Piłat";"Krzysztof";"M";"46";"Wyższe";"członek Platformy Obywatelskiej Rzeczypospolitej Polskiej";;"280501";"Ełk";"Ełk";;"N";"868";"20,93"
"1";"Pisz";"gmina pow. 20 tyś.";"281603";"Mayor";"KOMITET WYBORCZY WYBORCÓW POROZUMIENIE SPOŁECZNE JANA ALICKIEGO";"DOL-7503-58/10";"wyborczy";"1";"Alicki";"Jan";"M";"53";"wyższe";;;"281603";"Pisz";"Pisz";;"T";"8048";"66,28"
"1";"Giżycko";"gmina do 20 tyś.";"280604";"Reeve";"KOMITET WYBORCZY WYBORCÓW ""NIEZALEŻNI GMINY GIŻYCKO""";"DOL-7503-15/10";"wyborczy w gminie do 20 tys.";"4";"Sieroński";"Andrzej Włodzimierz";"M";"58";"średnie";"członek Polskiego Stronnictwa Ludowego";;"280604";"Giżycko";"Wilkasy";;"T";"1635";"53,15"
"1";"Giżycko";"gmina do 20 tyś.";"280604";"Reeve";"KOMITET WYBORCZY WYBORCÓW JERZEGO PUCZEL";"DOL-7503-120/10";"wyborczy w gminie do 20 tys.";"5";"Uss";"Jan";"M";"56";"średnie";;;"280604";"Giżycko";"Gajewo";;"N";"232";"7,54"
"1";"Lubomino";"gmina do 20 tyś.";"280904";"Reeve";"KOMITET WYBORCZY WYBORCÓW WARMIA NASZA MAŁA OJCZYZNA";"DEL-7503-12/10";"wyborczy";"1";"Mazur";"Andrzej Jan";"M";"52";"wyższe";"członek Platformy Obywatelskiej Rzeczypospolitej Polskiej";;"280904";"Lubomino";"Lubomino";;"T";"902";"77,09"
"1";"Ełk";"gmina pow. 20 tyś.";"280501";"President";"KOMITET WYBORCZY WYBORCÓW BUDŻET 2013";"DOL-7503-54/10";"wyborczy";"5";"Makowski";"Tomasz";"M";"37";"wyższe";;;"280501";"Ełk";"Ełk";;"N";"574";"3,05"
"1";"Stawiguda";"gmina do 20 tyś.";"281411";"Reeve";"KOMITET WYBORCZY WYBORCÓW POROZUMIENIE SAMORZĄDOWE NASZA GMINA";"DOL-7503-1/10";"wyborczy w gminie do 20 tys.";"1";"Marcinkiewicz";"Teodozy Jerzy";"M";"62";"Wyższe";;;"281411";"Stawiguda";"Bartążek";;"2";"1293";"49,52"
"1";"Jonkowo";"gmina do 20 tyś.";"281407";"Reeve";"KOMITET WYBORCZY WYBORCÓW WSPÓLNA GMINA JONKOWO";"DOL-7503-190/10";"wyborczy w gminie do 20 tys.";"1";"Giecko";"Wojciech";"M";"43";"wyższe";;;"281407";"Jonkowo";"Jonkowo";;"T";"1474";"75,51"
"1";"Braniewo";"gmina do 20 tyś.";"280201";"Mayor";"KOMITET WYBORCZY WYBORCÓW POROZUMIENIE SAMORZĄDOWE";"DEL-7503-30/10";"wyborczy";"1";"Mroziński";"Henryk";"M";"53";"wyższe";"członek Polskiego Stronnictwa Ludowego";;"280201";"Braniewo";"Braniewo";;"T";"5080";"66,51"
"1";"Biskupiec";"gmina do 20 tyś.";"281202";"Reeve";"KOMITET WYBORCZY POLSKIE STRONNICTWO LUDOWE";"ZPOW-7500-4/10";"partia";"3";"Tomaszewski";"Kazimierz";"M";"56";"wyższe";"członek Polskiego Stronnictwa Ludowego";;"281202";"Biskupiec";"Szwarcenowo";;"T";"2978";"82,22"
"1";"Biskupiec";"gmina do 20 tyś.";"281202";"Reeve";"KOMITET WYBORCZY NASZ DOM POLSKA - SAMOOBRONA ANDRZEJA LEPPERA";"ZPOW-7500-18/10";"partia";"2";"Skolmowski";"Eugeniusz Ludwik";"M";"49";"średnie";"członek Naszego Domu Polski - Samoobrony Andrzeja Leppera";;"281202";"Biskupiec";"Czachówki";;"N";"368";"10,16"
"1";"Kalinowo";"gmina do 20 tyś.";"280503";"Reeve";"KOMITET WYBORCZY WYBORCÓW MARKA MARKIEWICZ";"DOL-7503-186/10";"wyborczy w gminie do 20 tys.";"4";"Markiewicz";"Marek";"M";"47";"średnie";;;"280503";"Kalinowo";"Długie";;"N";"330";"12,42"
"1";"Ostróda";"gmina do 20 tyś.";"281509";"Reeve";"KOMITET WYBORCZY WYBORCÓW DOBRA GMINA";"DEL-7503-113/10";"wyborczy w gminie do 20 tys.";"2";"Fijas";"Bogusław Jerzy";"M";"47";"wyższe";;;"281509";"Ostróda";"Samborowo";;"N";"2360";"39,39"
"1";"Iława";"gmina do 20 tyś.";"280703";"Reeve";"KOMITET WYBORCZY POLSKIE STRONNICTWO LUDOWE";"ZPOW-7500-4/10";"partia";"2";"Małek";"Franciszek Jerzy";"M";"57";"wyższe";;;"280703";"Iława";"Franciszkowo";;"N";"1555";"36,94"
"1";"Szczytno";"gmina pow. 20 tyś.";"281701";"Mayor";"KOMITET WYBORCZY POLSKIE STRONNICTWO LUDOWE";"ZPOW-7500-4/10";"partia";"1";"Górska";"Danuta";"K";"53";"wyższe";;"popierana przez Polskie Stronnictwo Ludowe";"281701";"Szczytno";"Szczytno";;"T";"6752";"63,04"
"1";"Dywity";"gmina do 20 tyś.";"281404";"Reeve";"KOMITET WYBORCZY WYBORCÓW ODWAŻNIE I Z PERSPEKTYWĄ";"DOL-7503-108/10";"wyborczy w gminie do 20 tys.";"2";"Karpowicz";"Zbigniew Władysław";"M";"51";"wyższe";;;"281404";"Dywity";"Dywity";;"2";"1225";"28,76"
"1";"Kurzętnik";"gmina do 20 tyś.";"281204";"Reeve";"KOMITET WYBORCZY PRAWO I SPRAWIEDLIWOŚĆ";"ZPOW-7500-12/10";"partia";"2";"Piątek";"Piotr";"M";"47";"wyższe";;;"281204";"Kurzętnik";"Kurzętnik";;"N";"420";"12,53"
"1";"Płośnica";"gmina do 20 tyś.";"280305";"Reeve";"KOMITET WYBORCZY WYBORCÓW WYBORY 2010";"DEL-7503-240/10";"wyborczy w gminie do 20 tys.";"3";"Niedźwiecki";"Mieczysław Michał";"M";"57";"wyższe";;;"280305";"Płośnica";"Jabłonowo";;"N";"700";"28,07"
"1";"Lidzbark Warmiński";"gmina do 20 tyś.";"280903";"Reeve";"KOMITET WYBORCZY WYBORCÓW NASZE MIASTO NASZA WIEŚ";"DEL-7503-82/10";"wyborczy";"4";"Winckiewicz";"Krzysztof";"M";"53";"Wyższe";;;"280903";"Lidzbark Warmiński";"Rogóż";;"N";"306";"10,94"
"1";"Orneta";"gmina do 20 tyś.";"280905";"Mayor";"KOMITET WYBORCZY WYBORCÓW ""ORNETA""";"DEL-7503-6/10";"wyborczy w gminie do 20 tys.";"2";"Ołtuszewski";"Andrzej";"M";"61";"wyższe";;;"280905";"Orneta";"Orneta";;"N";"958";"17,96"
"1";"Działdowo";"gmina do 20 tyś.";"280302";"Reeve";"KOMITET WYBORCZY WYBORCÓW SAMORZĄDOWE ""UGRUPOWANIE LOKALNE""";"DEL-7503-54/10";"wyborczy";"1";"Cieśliński";"Paweł Stanisław";"M";"49";"wyższe rolnicze";;;"280302";"Działdowo";"Księży Dwór";;"T";"2718";"78,04"
"1";"Grunwald";"gmina do 20 tyś.";"281503";"Reeve";"KOMITET WYBORCZY WYBORCÓW ""GRUNWALD""";"DEL-7503-5/10";"wyborczy w gminie do 20 tys.";"2";"Kacprzyk";"Henryk Jan";"M";"58";"wyższe";;;"281503";"Grunwald";"Frygnowo";;"T";"1681";"74,61"
"1";"Kalinowo";"gmina do 20 tyś.";"280503";"Reeve";"KOMITET WYBORCZY WYBORCÓW ANDRZEJA BEZDZIECKIEGO";"DOL-7503-68/10";"wyborczy w gminie do 20 tys.";"1";"Bezdziecki";"Andrzej";"M";"48";"wyższe";;;"280503";"Kalinowo";"Kalinowo";;"T";"1669";"62,79"
"1";"Kalinowo";"gmina do 20 tyś.";"280503";"Reeve";"KOMITET WYBORCZY WYBORCÓW GRZEGORZA CZERWIŃSKIEGO";"DOL-7503-43/10";"wyborczy w gminie do 20 tys.";"2";"Czerwiński";"Grzegorz";"M";"42";"zawodowe";;;"280503";"Kalinowo";"Mazurowo";;"N";"82";"3,09"
"1";"Lubawa";"gmina do 20 tyś.";"280705";"Reeve";"KOMITET WYBORCZY WYBORCÓW POROZUMIENIE OBYWATELSKIE GMINY LUBAWA";"DEL-7503-47/10";"wyborczy w gminie do 20 tys.";"1";"Ewertowski";"Tomasz";"M";"40";"wyższe";;;"280705";"Lubawa";"BYSZWAŁD";;"T";"2603";"70,91"
"1";"Ryn";"gmina do 20 tyś.";"280608";"Mayor";"KOMITET WYBORCZY WYBORCÓW GMINA RYN 2010";"DOL-7503-44/10";"wyborczy w gminie do 20 tys.";"4";"Karpiński";"Józef";"M";"63";"wyższe";;;"280608";"Ryn";"Ryn";;"2";"1166";"49,98"
"1";"Olecko";"gmina pow. 20 tyś.";"281304";"Mayor";"KOMITET WYBORCZY WYBORCÓW MAŁA OJCZYZNA OLECKO";"DOL-7503-25/10";"wyborczy";"3";"Olszewski";"Wacław";"M";"52";"wyższe";;;"281304";"Olecko";"Olecko";;"T";"4787";"63,22"
"1";"Giżycko";"gmina pow. 20 tyś.";"280601";"Mayor";"KOMITET WYBORCZY WYBORCÓW WIARYGODNOŚĆ I PRZYZWOITOŚĆ";"DOL-7503-17/10";"wyborczy";"5";"Lemecha";"Marian Mirosław";"M";"65";"wyższe";;;"280601";"Giżycko";"Giżycko";;"N";"498";"4,76"
"1";"Mikołajki";"gmina do 20 tyś.";"281002";"Mayor";"KOMITET WYBORCZY WYBORCÓW RYSZARDA DĘBOWSKIEGO";"DOL-7503-188/10";"wyborczy w gminie do 20 tys.";"1";"Dębowski";"Ryszard Henryk";"M";"52";"wyższe";;;"281002";"Mikołajki";"Woźnice";;"N";"1355";"40,61"
"1";"Mikołajki";"gmina do 20 tyś.";"281002";"Mayor";"KOMITET WYBORCZY WYBORCÓW PIOTRA JAKUBOWSKIEGO";"DOL-7503-119/10";"wyborczy w gminie do 20 tys.";"2";"Jakubowski";"Piotr Zbigniew";"M";"47";"średnie";;;"281002";"Mikołajki";"Stare Sady";;"T";"1982";"59,39"
"1";"Kalinowo";"gmina do 20 tyś.";"280503";"Reeve";"KOMITET WYBORCZY POLSKIE STRONNICTWO LUDOWE";"ZPOW-7500-4/10";"partia";"3";"Filutowski";"Stanisław Andrzej";"M";"58";"wyższe";;;"280503";"Kalinowo";"Długie";;"N";"577";"21,71"
"1";"Stare Juchy";"gmina do 20 tyś.";"280505";"Reeve";"KOMITET WYBORCZY WYBORCÓW WIESŁAWA PTAKA";"DOL-7503-42/10";"wyborczy w gminie do 20 tys.";"3";"Ptak";"Wiesław";"M";"54";"zawodowe";;;"280505";"Stare Juchy";"Stare Juchy";;"N";"134";"7,15"
"1";"Lidzbark Warmiński";"gmina do 20 tyś.";"280901";"Mayor";"KOMITET WYBORCZY WYBORCÓW WARMIA NASZA MAŁA OJCZYZNA";"DEL-7503-12/10";"wyborczy";"3";"Wajs";"Artur Ryszard";"M";"45";"wyższe";"członek Platformy Obywatelskiej Rzeczypospolitej Polskiej";;"280901";"Lidzbark Warmiński";"Lidzbark Warmiński";;"T";"4445";"74,57"
"1";"Biała Piska";"gmina do 20 tyś.";"281601";"Mayor";"KOMITET WYBORCZY WYBORCÓW RYSZARDA SŁAWOMIRA SZUMOWSKIEGO ""WSPÓLNIE I SAMORZĄDNIE""";"DOL-7503-27/10";"wyborczy w gminie do 20 tys.";"4";"Szumowski";"Ryszard Sławomir";"M";"45";"wyższe";;;"281601";"Biała Piska";"Biała Piska";;"T";"3553";"65,29"
"1";"Kurzętnik";"gmina do 20 tyś.";"281204";"Reeve";"KOMITET WYBORCZY WYBORCÓW ZĄBEK";"DEL-7503-17/10";"wyborczy w gminie do 20 tys.";"4";"Ząbkiewicz";"Marek";"M";"48";"wyższe";;;"281204";"Kurzętnik";"Lipowiec";;"2";"914";"27,28"
"1";"Ełk";"gmina do 20 tyś.";"280502";"Reeve";"KOMITET WYBORCZY WYBORCÓW ANTONI POLKOWSKI";"DOL-7503-31/10";"wyborczy w gminie do 20 tys.";"3";"Polkowski";"Antoni";"M";"57";"Wyższe";"członek Polskiego Stronnictwa Ludowego";;"280502";"Ełk";"Mołdzie";"złożył następujące oświadczenie: byłem współpracownikiem organów bezpieczeństwa państwa w rozumieniu ustawy z dnia ustawy z dnia 18 października 2006 r. o ujawnianiu informacji o dokumentach organów bezpieczeństwa państwa z lat 1944-1990 oraz treści tych dokumentów (Dz. U z 2007 r. Nr 63, poz. 425, z późn. zm.)";"T";"2948";"71,09"
"1";"Lubawa";"gmina do 20 tyś.";"280702";"Mayor";"KOMITET WYBORCZY WYBORCÓW MACIEJA RADTKE";"DEL-7503-26/10";"wyborczy w gminie do 20 tys.";"2";"Radtke";"Maciej";"M";"39";"Wyższe";;;"280702";"Lubawa";"Lubawa";;"T";"1932";"53,67"
"1";"Węgorzewo";"gmina do 20 tyś.";"281903";"Mayor";"KOMITET WYBORCZY WYBORCÓW KRZYSZTOFA PIWOWARCZYKA";"DOL-7503-115/10";"wyborczy w gminie do 20 tys.";"2";"Piwowarczyk";"Krzysztof Andrzej";"M";"43";"wyższe";;;"281903";"Węgorzewo";"Węgorzewo";;"T";"4150";"79,70"
"1";"Janowo";"gmina do 20 tyś.";"281102";"Reeve";"KOMITET WYBORCZY WYBORCÓW ""GOSPODARNOŚĆ DLA JANOWA""";"DOL-7503-40/10";"wyborczy w gminie do 20 tys.";"2";"Szymański";"Waldemar Adam";"M";"58";"wyższe";;;"281102";"Janowo";"Komorowo";;"T";"747";"55,87"
"1";"Janowo";"gmina do 20 tyś.";"281102";"Reeve";"KOMITET WYBORCZY WYBORCÓW WSPÓLNOTA SAMORZĄDOWA PRAWICY";"DOL-7503-6/10";"wyborczy";"1";"Bartkowski";"Dariusz";"M";"42";"średnie";;;"281102";"Janowo";"Janowo";;"N";"590";"44,13"
"1";"Wilczęta";"gmina do 20 tyś.";"280207";"Reeve";"KOMITET WYBORCZY WYBORCÓW BOGUSŁAWA SZCZERBA";"DEL-7503-3/10";"wyborczy w gminie do 20 tys.";"2";"Szczerba";"Bogusław";"M";"50";"średnie";;;"280207";"Wilczęta";"Wilczęta";;"T";"1078";"78,63"
"1";"Wilczęta";"gmina do 20 tyś.";"280207";"Reeve";"KOMITET WYBORCZY WYBORCÓW NASZA GMINA";"DEL-7503-116/10";"wyborczy w gminie do 20 tys.";"1";"Nowosielski";"Andrzej Franciszek";"M";"57";"wyższe";;;"280207";"Wilczęta";"Wilczęta";;"N";"293";"21,37"
"1";"Płoskinia";"gmina do 20 tyś.";"280206";"Reeve";"KOMITET WYBORCZY WYBORCÓW NASZ SAMORZĄD";"DEL-7503-69/10";"wyborczy";"1";"Kowalski";"Zbigniew Andrzej";"M";"41";"Wyższe";;;"280206";"Płoskinia";"Dąbrowa";;"T";"860";"90,53"
"1";"Morąg";"gmina pow. 20 tyś.";"281508";"Mayor";"KOMITET WYBORCZY WYBORCÓW MORĄSKA DEMOKRACJA";"DEL-7503-126/10";"wyborczy";"2";"Szeluga";"Stanisław Zbigniew";"M";"53";"wyższe";;;"281508";"Morąg";"Morąg";;"N";"2859";"28,83"
"1";"Morąg";"gmina pow. 20 tyś.";"281508";"Mayor";"KOMITET WYBORCZY WYBORCÓW ""ZGODA I ROZWÓJ""";"DEL-7503-2/10";"wyborczy";"1";"Sobierajski";"Tadeusz Zbigniew";"M";"60";"Wyższe";;;"281508";"Morąg";"Morąg";;"T";"7058";"71,17"
"1";"Lidzbark";"gmina do 20 tyś.";"280304";"Mayor";"KOMITET WYBORCZY WYBORCÓW ""NASZ SAMORZĄD""";"DEL-7503-95/10";"wyborczy w gminie do 20 tys.";"2";"Łużyński";"Witold";"M";"55";"średnie";;;"280304";"Lidzbark";"Lidzbark";;"N";"127";"2,25"
"1";"Świątki";"gmina do 20 tyś.";"281412";"Reeve";"KOMITET WYBORCZY WYBORCÓW POROZUMIENIE SAMORZĄDOWE ŚWIĄTKI";"DOL-7503-157/10";"wyborczy w gminie do 20 tys.";"3";"Zubalska";"Teresa";"K";"46";"Wyższe";;;"281412";"Świątki";"Kwiecewo";;"N";"326";"20,24"
"1";"Korsze";"gmina do 20 tyś.";"280804";"Mayor";"KOMITET WYBORCZY PRAWO I SPRAWIEDLIWOŚĆ";"ZPOW-7500-12/10";"partia";"2";"Flis";"Zdzisław Andrzej";"M";"45";"wyższe ekonomiczne";"członek Prawa i Sprawiedliwości";;"280804";"Korsze";"Korsze";;"N";"424";"11,22"
"1";"Iława";"gmina pow. 20 tyś.";"280701";"Mayor";"KOMITET WYBORCZY PLATFORMA OBYWATELSKA RP";"ZPOW-7500-10/10";"partia";"2";"Ptasznik";"Włodzimierz Lew";"M";"63";"wyższe";"członek Platformy Obywatelskiej Rzeczypospolitej Polskiej";"popierany przez Platformę Obywatelską Rzeczypospolitej Polskiej";"280701";"Iława";"Iława";;"T";"4991";"51,15"
"1";"Elbląg";"miasto na prawach powiatu";"286101";"President";"KOMITET WYBORCZY WYBORCÓW DEMOKRATYCZNY ELBLĄG";"DEL-7503-232/10";"wyborczy";"3";"Rembelski";"Stefan Bolesław";"M";"53";"wyższe techniczne";"członek Stronnictwa Demokratycznego";;"286101";"Elbląg";"Elbląg";;"N";"826";"2,28"
"1";"Iława";"gmina pow. 20 tyś.";"280701";"Mayor";"KOMITET WYBORCZY SOJUSZ LEWICY DEMOKRATYCZNEJ";"ZPOW-7500-8/10";"partia";"4";"Zabłotny";"Ryszard Tadeusz";"M";"64";"wyższe";"członek Sojuszu Lewicy Demokratycznej";"popierany przez Sojusz Lewicy Demokratycznej";"280701";"Iława";"Iława";;"N";"2335";"23,93"
"1";"Iława";"gmina pow. 20 tyś.";"280701";"Mayor";"KOMITET WYBORCZY WYBORCÓW ""WSPÓLNOTA""";"DEL-7503-89/10";"wyborczy";"3";"Witkowski";"Henryk";"M";"57";"wyższe";;;"280701";"Iława";"Iława";;"N";"840";"8,61"
"1";"Iława";"gmina pow. 20 tyś.";"280701";"Mayor";"KOMITET WYBORCZY PRAWO I SPRAWIEDLIWOŚĆ";"ZPOW-7500-12/10";"partia";"1";"Polański";"Marek Józef";"M";"55";"wyższe";"członek Prawa i Sprawiedliwości";"popierany przez Prawo i Sprawiedliwość";"280701";"Iława";"Iława";;"N";"1592";"16,31"
"1";"Ruciane-Nida";"gmina do 20 tyś.";"281604";"Mayor";"KOMITET WYBORCZY WYBORCÓW FORUM SAMORZĄDOWE POWIATU PISKIEGO";"DOL-7503-3/10";"wyborczy";"3";"Opalach";"Zbigniew Janusz";"M";"51";"wyższe";;;"281604";"Ruciane-Nida";"Osiniak-Piotrowo";;"2";"1291";"32,23"
"1";"Lidzbark Warmiński";"gmina do 20 tyś.";"280901";"Mayor";"KOMITET WYBORCZY WYBORCÓW WSPÓLNOTA SAMORZĄDOWA ""RAZEM""";"DEL-7503-267/10";"wyborczy";"2";"Sierputowicz";"Leszek";"M";"44";"wyższe";"członek Prawa i Sprawiedliwości";;"280901";"Lidzbark Warmiński";"Lidzbark Warmiński";;"N";"727";"12,20"
"1";"Pisz";"gmina pow. 20 tyś.";"281603";"Mayor";"KOMITET WYBORCZY PRAWO I SPRAWIEDLIWOŚĆ";"ZPOW-7500-12/10";"partia";"3";"Małecki";"Jerzy Wojciech";"M";"38";"średnie";"członek Prawa i Sprawiedliwości";;"281603";"Pisz";"Jagodne";;"N";"897";"7,39"
"1";"Elbląg";"gmina do 20 tyś.";"280401";"Reeve";"KOMITET WYBORCZY WYBORCÓW GENOWEFY KWOCZEK";"DEL-7503-133/10";"wyborczy w gminie do 20 tys.";"1";"Kwoczek";"Genowefa";"K";"55";"wyższe";;;"280401";"Elbląg";"Gronowo Górne";;"T";"1532";"73,87"
"1";"Wieliczki";"gmina do 20 tyś.";"281306";"Reeve";"KOMITET WYBORCZY POLSKIE STRONNICTWO LUDOWE";"ZPOW-7500-4/10";"partia";"4";"Steckiewicz";"Andrzej Edmund";"M";"48";"wyższe";"członek Polskiego Stronnictwa Ludowego";;"281306";"Wieliczki";"Małe Olecko";;"N";"126";"8,05"
"1";"Miłakowo";"gmina do 20 tyś.";"281506";"Mayor";"KOMITET WYBORCZY WYBORCÓW ""2010""";"DEL-7503-223/10";"wyborczy w gminie do 20 tys.";"3";"Zalewa";"Henryk";"M";"58";"średnie";;;"281506";"Miłakowo";"Miłakowo";;"N";"379";"17,34"
"1";"Ostróda";"gmina pow. 20 tyś.";"281501";"Mayor";"KOMITET WYBORCZY WYBORCÓW SAMORZĄDOWY RUCH SPOŁECZNY";"DEL-7503-239/10";"wyborczy";"4";"Kopczyński";"Jan";"M";"57";"wyższe";;;"281501";"Ostróda";"Ostróda";;"N";"159";"1,36"
"1";"Nowe Miasto Lubawskie";"gmina do 20 tyś.";"281201";"Mayor";"KOMITET WYBORCZY WYBORCÓW WSPÓLNE DOBRO 2010";"DEL-7503-236/10";"wyborczy";"4";"Prusakowski";"Roman Michał";"M";"52";"wyższe";;;"281201";"Nowe Miasto Lubawskie";"Nowe Miasto Lubawskie";;"N";"525";"13,38"
"1";"Olsztyn";"miasto na prawach powiatu";"286201";"President";"KOMITET WYBORCZY SOJUSZ LEWICY DEMOKRATYCZNEJ";"ZPOW-7500-8/10";"partia";"4";"Kulasek";"Marcin Robert";"M";"34";"wyższe";"członek Sojuszu Lewicy Demokratycznej";;"286201";"Olsztyn";"Olsztyn";;"N";"1126";"1,85"
"1";"Rychliki";"gmina do 20 tyś.";"280408";"Reeve";"KOMITET WYBORCZY WYBORCÓW POROZUMIENIE SAMORZĄDOWO - LUDOWE";"DEL-7503-90/10";"wyborczy";"2";"Kogut";"Roman";"M";"60";"wyższe";;;"280408";"Rychliki";"Rychliki";;"N";"600";"38,76"
"1";"Barczewo";"gmina do 20 tyś.";"281401";"Mayor";"KOMITET WYBORCZY WYBORCÓW ""2010 - RAZEM W PRZYSZŁOŚĆ""";"DOL-7503-98/10";"wyborczy w gminie do 20 tys.";"2";"Wrzosek";"Aleksander Józef";"M";"63";"wyższe";;;"281401";"Barczewo";"Łapka";;"N";"1414";"25,91"
"1";"Szczytno";"gmina do 20 tyś.";"281706";"Reeve";"KOMITET WYBORCZY STOWARZYSZENIE ""WSPÓLNOTA SAMORZĄDOWA POWIATU SZCZYCIEŃSKIEGO"" W SZCZYTNIE";"DOL-7502-1/10";"organizacja";"3";"Żywica";"Adam Władysław";"M";"44";"Wyższe";;;"281706";"Szczytno";"Wały";;"N";"618";"13,21"
"1";"Sępopol";"gmina do 20 tyś.";"280106";"Mayor";"KOMITET WYBORCZY PRAWO I SPRAWIEDLIWOŚĆ";"ZPOW-7500-12/10";"partia";"1";"Farulewska";"Barbara";"K";"49";"średnie";;;"280103";"Bartoszyce";"Bezledy";;"N";"185";"6,74"
"1";"Purda";"gmina do 20 tyś.";"281410";"Reeve";"KOMITET WYBORCZY WYBORCÓW POROZUMIENIE SAMORZĄDOWE PURDA";"DOL-7503-124/10";"wyborczy w gminie do 20 tys.";"2";"Płoski";"Piotr Karol";"M";"32";"wyższe";"członek Polskiego Stronnictwa Ludowego";;"281410";"Purda";"Klewki";;"N";"903";"32,56"
"1";"Ostróda";"gmina pow. 20 tyś.";"281501";"Mayor";"KOMITET WYBORCZY PRAWO I SPRAWIEDLIWOŚĆ";"ZPOW-7500-12/10";"partia";"5";"Najmowicz";"Czesław Jan";"M";"55";"wyższe";"członek Prawa i Sprawiedliwości";;"281501";"Ostróda";"Ostróda";;"N";"2337";"20,03"
"1";"Olsztyn";"miasto na prawach powiatu";"286201";"President";"KOMITET WYBORCZY PLATFORMA OBYWATELSKA RP";"ZPOW-7500-10/10";"partia";"1";"Cichoń";"Janusz";"M";"53";"wyższe";"członek Platformy Obywatelskiej Rzeczypospolitej Polskiej";;"286201";"Olsztyn";"Olsztyn";;"N";"8160";"13,39"
"1";"Ostróda";"gmina pow. 20 tyś.";"281501";"Mayor";"KOMITET WYBORCZY PLATFORMA OBYWATELSKA RP";"ZPOW-7500-10/10";"partia";"1";"Brodiuk";"Włodzimierz Michał";"M";"56";"wyższe";"członek Platformy Obywatelskiej Rzeczypospolitej Polskiej";;"281501";"Ostróda";"Ostróda";;"2";"2388";"20,47"
"1";"Ostróda";"gmina pow. 20 tyś.";"281501";"Mayor";"KOMITET WYBORCZY WYBORCÓW SAMORZĄDOWE PRZYMIERZE OSTRÓDY";"DEL-7503-73/10";"wyborczy";"3";"Dudzin";"Jacek";"M";"50";"wyższe, ekonomiczne";;;"281501";"Ostróda";"Ostróda";;"N";"1325";"11,36"
"1";"Lidzbark Warmiński";"gmina do 20 tyś.";"280903";"Reeve";"KOMITET WYBORCZY WYBORCÓW NOWOCZESNA GMINA LIDZBARK WARMIŃSKI";"DEL-7503-198/10";"wyborczy w gminie do 20 tys.";"2";"Kielak";"Danuta";"K";"50";"Średnie";;;"280903";"Lidzbark Warmiński";"Kraszewo";;"N";"257";"9,19"
"1";"Ostróda";"gmina pow. 20 tyś.";"281501";"Mayor";"KOMITET WYBORCZY WYBORCÓW JANA NOSEWICZA";"DEL-7503-138/10";"wyborczy";"2";"Dąbrowski";"Olgierd";"M";"58";"wyższe";;;"281501";"Ostróda";"Ostróda";;"2";"5459";"46,79"
"1";"Bartoszyce";"gmina do 20 tyś.";"280103";"Reeve";"KOMITET WYBORCZY WYBORCÓW ODRODZENIE";"DEL-7503-75/10";"wyborczy";"2";"Ołdakowski";"Adam";"M";"54";"wyższe";;;"280103";"Bartoszyce";"Witki";;"2";"1299";"30,64"
"1";"Górowo Iławeckie";"gmina do 20 tyś.";"280105";"Reeve";"KOMITET WYBORCZY WYBORCÓW TADEUSZA PENCARSKIEGO";"DEL-7503-50/10";"wyborczy";"4";"Pencarski";"Tadeusz";"M";"55";"średnie";;;"280105";"Górowo Iławeckie";"Pieszkowo";;"N";"575";"16,75"
"1";"Rychliki";"gmina do 20 tyś.";"280408";"Reeve";"KOMITET WYBORCZY WYBORCÓW HENRYKA KIEJDO ""DOBRY GOSPODARZ""";"DEL-7503-216/10";"wyborczy w gminie do 20 tys.";"1";"Kiejdo";"Henryk";"M";"55";"wyższe";;;"280408";"Rychliki";"Rychliki";;"T";"818";"52,84"
"1";"Rychliki";"gmina do 20 tyś.";"280408";"Reeve";"KOMITET WYBORCZY PLATFORMA OBYWATELSKA RP";"ZPOW-7500-10/10";"partia";"3";"Koprowski";"Stanisław";"M";"52";"wyższe";;;"280408";"Rychliki";"Kwietniewo";;"N";"130";"8,40"
"1";"Szczytno";"gmina do 20 tyś.";"281706";"Reeve";"KOMITET WYBORCZY WYBORCÓW NIEZALEŻNI";"DOL-7503-23/10";"wyborczy w gminie do 20 tys.";"2";"Wojciechowski";"Sławomir";"M";"49";"Wyższe";;;"281706";"Szczytno";"Kamionek";;"T";"3595";"76,87"
"1";"Banie Mazurskie";"gmina do 20 tyś.";"281801";"Reeve";"KOMITET WYBORCZY PLATFORMA OBYWATELSKA RP";"ZPOW-7500-10/10";"partia";"1";"Bogusz";"Ryszard";"M";"47";"wyższe";;;"281801";"Banie Mazurskie";"Banie Mazurskie";;"2";"819";"44,15"
"1";"Nowe Miasto Lubawskie";"gmina do 20 tyś.";"281201";"Mayor";"KOMITET WYBORCZY PRAWO I SPRAWIEDLIWOŚĆ";"ZPOW-7500-12/10";"partia";"2";"Godziński";"Damian Jan";"M";"32";"wyższe";"członek Prawa i Sprawiedliwości";;"281201";"Nowe Miasto Lubawskie";"Nowe Miasto Lubawskie";;"N";"298";"7,59"
"1";"Kurzętnik";"gmina do 20 tyś.";"281204";"Reeve";"KOMITET WYBORCZY WYBORCÓW JANA ROCHEWICZA";"DEL-7503-274/10";"wyborczy w gminie do 20 tys.";"3";"Rochewicz";"Jan";"M";"45";"wyższe";"członek Samoobrony Rzeczpospolitej Polskiej";;"281204";"Kurzętnik";"Krzemieniewo";;"N";"462";"13,79"
"1";"Bartoszyce";"gmina do 20 tyś.";"280103";"Reeve";"KOMITET WYBORCZY POLSKIE STRONNICTWO LUDOWE";"ZPOW-7500-4/10";"partia";"3";"Zabłocki";"Wojciech";"M";"39";"wyższe";"członek Polskiego Stronnictwa Ludowego";;"280101";"Bartoszyce";"Bartoszyce";;"N";"1277";"30,13"
"1";"Gietrzwałd";"gmina do 20 tyś.";"281405";"Reeve";"KOMITET WYBORCZY SOJUSZ LEWICY DEMOKRATYCZNEJ";"ZPOW-7500-8/10";"partia";"3";"Kowalski";"Marek Jarosław";"M";"45";"średnie techniczne";;;"281405";"Gietrzwałd";"Unieszewo";;"N";"292";"13,66"
"1";"Prostki";"gmina do 20 tyś.";"280504";"Reeve";"KOMITET WYBORCZY POLSKIE STRONNICTWO LUDOWE";"ZPOW-7500-4/10";"partia";"4";"Karwowski";"Robert";"M";"38";"wyższe";"członek Polskiego Stronnictwa Ludowego";"popierany przez Polskie Stronnictwo Ludowe";"280501";"Ełk";"Ełk";;"N";"164";"5,66"
"1";"Elbląg";"miasto na prawach powiatu";"286101";"President";"KOMITET WYBORCZY SOJUSZ LEWICY DEMOKRATYCZNEJ";"ZPOW-7500-8/10";"partia";"1";"Gintowt-Dziewałtowski";"Witold Józef";"M";"61";"wyższe";"członek Sojuszu Lewicy Demokratycznej";;"286101";"Elbląg";"Elbląg";;"N";"5025";"13,84"
"1";"Nowe Miasto Lubawskie";"gmina do 20 tyś.";"281205";"Reeve";"KOMITET WYBORCZY PRAWO I SPRAWIEDLIWOŚĆ";"ZPOW-7500-12/10";"partia";"3";"Waruszewski";"Tomasz";"M";"34";"wyższe";;;"281205";"Nowe Miasto Lubawskie";"Gwiździny";;"2";"1232";"38,05"
