"060000";"lubelskie";"061304";"Parczew";"rural area in urban-rural commune";"6";"Publiczne Przedszkole Nr 1 w Parczewie, ul. Wojska Polskiego 8a, Parczew";"General";"Yes";"Parczew sołectwa: Komarne, Laski , Pohulanka , Siedliki , Sowin"
"060000";"lubelskie";"061304";"Parczew";"rural area in urban-rural commune";"7";"Zakład Doskonalenia Zawodowego w Parczewie, ul. Harcerska 8, Parczew";"General";"Yes";"Parczew ulice: Agrestowa, Bema , Chabrowa, Deszczowa, Klonowa, Krzywa, Laskowska, Malinowa, Morelowa, Orzechowa, Plac Wolności , Polna , Strażacka, Szeroka , Wiśniowa , Żabia"
"060000";"lubelskie";"061304";"Parczew";"rural area in urban-rural commune";"8";"Szkoła Podstawowa Nr 2 w Parczewie, ul. Polna 34, Parczew";"General";"No";"Parczew ulice: Cicha, Dworcowa, Harcerska, Kolejowa, Pogodna, Poprzeczna, Prosta , Siemieńska, Składnicowa, Spokojna , Tartaczna, Władysława Jagiełły, Zgodna, Przemysłowa, Zbożowa"
"060000";"lubelskie";"061304";"Parczew";"rural area in urban-rural commune";"9";"Remiza Strażacka w Koczergach, Koczergi 97, Koczergi";"General";"No";"Parczew sołectwa: Brudno, Koczergi , Królewski Dwór, "
"060000";"lubelskie";"061304";"Parczew";"rural area in urban-rural commune";"10";"Publiczna Szkoła Podstawowa w Tyśmienicy, Tyśmienica 115, Tyśmienica";"General";"No";"Parczew sołectwa: Babianka, Buradów , Tyśmienica"
"060000";"lubelskie";"061304";"Parczew";"rural area in urban-rural commune";"11";"Zespół Placówek Szkolnych w Przewłoce, Przewłoka 98, Przewłoka";"General";"No";"Parczew sołectwa: Michałówka , Przewłoka , Wola Przewłocka , Zaniówka"
"060000";"lubelskie";"061304";"Parczew";"rural area in urban-rural commune";"12";"Samodzielny Publiczny Zakład Opieki Zdrowotnej w Parczewie ul. Kościelna 124, 21-200 Parczew";"Hospital";"Yes";"Szpital"
"060000";"lubelskie";"061305";"Podedwórze";"rural commune";"1";"Urząd Gminy w Podedwórzu, Podedwórze 44, Podedwórze";"General";"No";"Granice miejscowości: Antopol, Hołowno, Kaniuki, Opole, Podedwórze, Rusiły, Zaliszcze"
"060000";"lubelskie";"061305";"Podedwórze";"rural commune";"2";"Remiza OSP w Bojarach, Bojary 33, Bojary";"General";"Yes";"Granice miejscowości: Bojary, Grabówka, Mosty, Nowe Mosty, Niecielin, Piechy"
"060000";"lubelskie";"061306";"Siemień";"rural commune";"1";"Sala Gimnastyczna w Siemieniu, ul. Kościelna1,Siemień";"General";"Yes";"Łubka, Miłków, Miłków Kolonia, Pomyków, Siemień, Tulniki, Wola Tulnicka, Wólka Siemieńska"
"060000";"lubelskie";"061306";"Siemień";"rural commune";"2";"Świetlica Wiejska w Żminnem, Żminne 30,Żminne";"General";"No";"Augustówka, Glinny Stok, Jezioro, Żminne"
"060000";"lubelskie";"061306";"Siemień";"rural commune";"3";"Remiza OSP w Działyniu, Działyń 4,Działyń";"General";"No";"Amelin, Działyń, Juliopol, Sewerynówka, Wierzchowiny Nowe, Wierzchowiny Stare"
"060000";"lubelskie";"061306";"Siemień";"rural commune";"4";"Szkoła Podstawowa w Gródku Szlacheckim, Gródek Szlachecki 140,Gródek Szlachecki";"General";"No";"Gródek Szlachecki, Nadzieja, Władysławów"
"060000";"lubelskie";"061307";"Sosnowica";"rural commune";"1";"Świetlica Klubu Wiejskiego w Nowym Orzechowie, Nowy Orzechów 42, Nowy Orzechów";"General";"No";"sołectwo Stary Orzechów sołectwo Nowy Orzechów sołectwo Lejno"
"060000";"lubelskie";"061307";"Sosnowica";"rural commune";"2";"Szkoła Podstawowa w Sosnowicy, ul. Wojska Polskiego 27, Sosnowica";"General";"No";"Sołectwo Sosnowica Sołectwo Lipniak Sołectwo Pieszowola Sołectwo Zbójno Sołectwo Turno Sołectwo Sosnowica Dwór Sołectwo Kropiwki Sołectwo Olchówka"
"060000";"lubelskie";"061307";"Sosnowica";"rural commune";"3";"Świetlica Klubu Wiejskiego w Zienkach,  Zienki 4A, Zienki";"General";"Yes";"Sołectwo Zienki Sołectwo Komarówka Sołectwo Górki"
"060000";"lubelskie";"061402";"Baranów";"rural commune";"1";"Urząd Gminy, ul. Rynek 14, Baranów";"General";"No";"Baranów, Pogonów, Motoga, Czołna"
"060000";"lubelskie";"061402";"Baranów";"rural commune";"2";"Szkoła Podstawowa, Gródek 32";"General";"No";"Łukawka, Gródek, Łukawica, Karczunek, Zagóźdź, Składów, Dębczyna, Nowomichowska"
"060000";"lubelskie";"061402";"Baranów";"rural commune";"3";"Świetlica wiejska, Śniadówka 48";"General";"Yes";"Śniadówka, Klin, Łysa Góra, Niwa"
"060000";"lubelskie";"061402";"Baranów";"rural commune";"4";"Świetlica wiejska, Kozioł 40B";"General";"No";"Wola Czołnowska, Kozioł, Huta"
"060000";"lubelskie";"061403";"Janowiec";"rural commune";"1";"Gminny Ośrodek Kultury, ul. Plac Wolności 1, Janowiec";"General";"No";"Brześce, Brześce Kolonia, Janowice, Janowiec, Oblasy"
"060000";"lubelskie";"061403";"Janowiec";"rural commune";"2";"Strażnica OSP, Wojszyn";"General";"Yes";"Nasiłów, Trzcianki, Wojszyn"
"060000";"lubelskie";"061404";"Kazimierz Dolny";"rural area in urban-rural commune";"1";"Zespół Szkół, ul. Nadwiślańska 9, Kazimierz Dolny";"General";"Yes";"Kazimierz Dolny - ulice: Albrechtówka, Browarna, Bulwar, Cmentarna, Czerniawy, Dębowe Góry, Doły, Droga Akacjowa, Droga Jaśminowa, Filtrowa, Góry, Klasztorna, Krakowska, Krzywe Koło, Kwaskowa Góra, Lubelska, Małachowskiego, Mały Rynek, Nadedworce, Nadrzeczna, Nadwiślańska, Norowy Dół, Plebanka, Podgórna, Podzamcze, Puławska, Rynek, Sadowa, Senatorska, Słoneczna, Szkolna, Tyszkiewicza, Witkiewicza, Zamkowa, Zbożowa. Mięćmierz, Okale."
"060000";"lubelskie";"061404";"Kazimierz Dolny";"rural area in urban-rural commune";"2";"Gminny Zespół Szkół, ul. Szkolna 1, Kazimierz Dolny";"General";"No";"Cholewianka, Jeziorszczyzna, Dąbrówka , Góry , Skowieszynek, Wylągi."
"060000";"lubelskie";"061404";"Kazimierz Dolny";"rural area in urban-rural commune";"3";"Szkoła Podstawowa, Bochotnica";"General";"No";"Bochotnica, Wierzchoniów."
"060000";"lubelskie";"061404";"Kazimierz Dolny";"rural area in urban-rural commune";"4";"Szkoła Podstawowa, Rzeczyca";"General";"No";"Rzeczyca, Rzeczyca Kolonia, Witoszyn."
"060000";"lubelskie";"061404";"Kazimierz Dolny";"rural area in urban-rural commune";"5";"Szkoła Podstawowa, Parchatka";"General";"No";"Parchatka, Zbędowice."
"060000";"lubelskie";"061405";"Końskowola";"rural commune";"1";"Gminny Ośrodek Kultury, ul. Lubelska 93, Końskowola";"General";"Yes";"Młynki, Rudy, Stara Wieś, Wronów"
"060000";"lubelskie";"061405";"Końskowola";"rural commune";"2";"Gimnazjum, ul. Lubelska 81, Końskowola";"General";"Yes";"Końskowola"
"060000";"lubelskie";"061405";"Końskowola";"rural commune";"3";"Szkoła Podstawowa, Pożog";"General";"No";"Nowy Pożóg, Stary Pożóg"
"060000";"lubelskie";"061405";"Końskowola";"rural commune";"4";"Remiza OSP, Witowice";"General";"Yes";"Opoka, Pulki, Witowice"
"060000";"lubelskie";"061405";"Końskowola";"rural commune";"5";"Szkoła Podstawowa, Skowieszyn";"General";"No";"Skowieszyn"
"060000";"lubelskie";"061405";"Końskowola";"rural commune";"6";"Remiza OSP, Stok";"General";"No";"Las Stocki, Stok"
"060000";"lubelskie";"061405";"Końskowola";"rural commune";"7";"Szkoła Podstawowa, Chrząchów";"General";"No";"Chrząchów, Chrząchówek"
"060000";"lubelskie";"061405";"Końskowola";"rural commune";"8";"Szkoła Podstawowa, Sielce";"General";"No";"Sielce"
"060000";"lubelskie";"061406";"Kurów";"rural commune";"1";"Gminny Ośrodek Kultury, ul. Kilińskiego 2, Kurów";"General";"No";"sołectwo: Kurów"
"060000";"lubelskie";"061406";"Kurów";"rural commune";"2";"Urząd Gminy Kurów, ul. Lubelska 35, Kurów";"General";"Yes";"sołectwa: Brzozowa Gać, Olesin, Płonki, Szumów, Wygoda"
"060000";"lubelskie";"061406";"Kurów";"rural commune";"3";"Szkoła Podstawowa, Kłoda 12A";"General";"No";"sołectwa: Barłogi, Kłoda, Łąkoć, Zastawie"
"060000";"lubelskie";"061406";"Kurów";"rural commune";"4";"Szkoła Podstawowa, Klementowice 230";"General";"Yes";"sołectwa: Buchałowice, Klementowice"
"060000";"lubelskie";"061406";"Kurów";"rural commune";"5";"Szkoła Podstawowa, Dęba 1";"General";"No";"sołectwa: Bronisławka, Choszczów, Dęba, Marianka, Posiołek, Wólka Nowodworska"
"060000";"lubelskie";"061407";"Markuszów";"rural commune";"1";"Szkoła Podstawowa, ul. Lubelska 80, Markuszów";"General";"Yes";"Markuszów"
"060000";"lubelskie";"061407";"Markuszów";"rural commune";"2";"Gminny Dom Kultury, ul. M.Sobieskiego 1, Markuszów";"General";"No";"Góry, Góry-Kolonia, Kaleń, Łany, Olempin, Olszowiec, Zabłocie."
"060000";"lubelskie";"061407";"Markuszów";"rural commune";"3";"Dom Ludowy, Bobowiska 35 a";"General";"No";"Bobowiska, Wólka Kątna"
"060000";"lubelskie";"061408";"Nałęczów";"rural area in urban-rural commune";"1";"SP Zakład Opieki Zdrowotnej, ul. Kolejowa 7, Nałęczów";"General";"Yes";"Nałęczów ulice: Michała Elwira Andriollego, Armatna Góra, Brzozy, Heleny i Kazimierza Dulębów, Ewy Szelburg-Zarembiny, Głębocznica, Kolejowa, Modrzewiowa, Faustyny Morzyckiej, Fortunata Nowickiego, Pałuby, Partyzantów, Stanisława Augusta Poniatowskiego, Słoneczna, Henryka Sienkiewicza, Spółdzielcza, Andrzeja Struga, Marii Świtalskiej, Jana Witkiewicza, Stefana Żeromskiego."
"060000";"lubelskie";"061408";"Nałęczów";"rural area in urban-rural commune";"2";"Liceum Plastyczne, ul. Lipowa 30, Nałęczów";"General";"No";"Nałęczów ulice: Bochotnica, Cynkowska, Graniczna, Łąkowa, Słowicza, Wojciechowska, Grzegorza Wójcika."
"060000";"lubelskie";"061408";"Nałęczów";"rural area in urban-rural commune";"3";"CSW ""Energetyk"", ul. Paderewskiego 10, Nałęczów";"General";"No";"Nałęczów ulice: Batalionów Chłopskich, Charz A, Zygmunta Chmielewskiego, Bartosza Głowackiego, Harcerska, Kamieniak, Klonowa, Kombatanów, Wacława Lasockiego, Piaskowa, Ignacego Paderewskiego, Różana, Tadeusza Sołdka, Spacerowa, Wiejska, Henryka Wiercieńskiego. Chruszczów Kolonia."
"060000";"lubelskie";"061408";"Nałęczów";"rural area in urban-rural commune";"4";"Nałęczowski Ośrodek Kultury, ul. Lipowa 6, Nałęczów";"General";"Yes";"Nałęczów ulice: Fryderyka Chopina, Grabowa, Michała Górskiego, Kasztanowa, Tadeusza Kościuszki, Lipowa, Leśna, Stanisława Małachowskiego, 1-go Maja, Polna, Bolesława Prusa, Przesmyk, Powstańców 1863 r., Ewy Szelburg-Zarembiny. Strzelce."
"060000";"lubelskie";"061408";"Nałęczów";"rural area in urban-rural commune";"5";"Szkoła Podstawowa w Drzewcach, Drzewce-Kolonia 82A";"General";"No";"Drzewce-Kolonia."
"060000";"lubelskie";"061408";"Nałęczów";"rural area in urban-rural commune";"6";"Zakład Rolniczy w Antopolu, Bochotnica-Kolonia 16";"General";"No";"Bochotnica-Kolonia, Cynków."
"060000";"lubelskie";"061408";"Nałęczów";"rural area in urban-rural commune";"7";"Szkoła Podstawowa, Sadurki 106";"General";"No";"Sadurki."
"060000";"lubelskie";"061408";"Nałęczów";"rural area in urban-rural commune";"8";"Szkoła Podstawowa, Czesławice 13";"General";"No";"Czesławice."
"060000";"lubelskie";"061408";"Nałęczów";"rural area in urban-rural commune";"9";"Szkoła Podstawowa, Piotrowice 107";"General";"No";"Ludwinów, Paulinów, Piotrowice."
"060000";"lubelskie";"061408";"Nałęczów";"rural area in urban-rural commune";"10";"Remiza OSP, Bronice";"General";"No";"Bronice, Bronice-Kolonia."
"060000";"lubelskie";"061408";"Nałęczów";"rural area in urban-rural commune";"11";"Remiza OSP, Drzewce";"General";"No";"Drzewce."
"060000";"lubelskie";"061401";"Puławy";"urban commune";"1";"Nauczycielskie Kolegium Języków Obcych, ul. Kołłątaja 64, Puławy";"General";"No";"Budowlanych, Dęblińska, Długa, Gołębska, Kołłątaja nieparzyste od nr 41 do końca i parzyste od nr 54 do końca, Kombatantów, Komunalna, Kwiatkowskiego, Majdan, Młyńska, Mościckiego, Piaskowa nieparzyste od nr 63 do końca, 6 Sierpnia nieparzyste od nr 45 do końca i parzyste od nr 52 do końca, Wczasowa, Wiślana, Wólka Profecka, Zarzecze."
"060000";"lubelskie";"061401";"Puławy";"urban commune";"2";"Szkoła Podstawowa Nr 10, ul. 6 Sierpnia 30, Puławy";"General";"No";"Kołłątaja nieparzyste od nr 1 do nr 39 i parzyste od nr 2 do nr 26, 3 Maja, Marszałka Piłsudskiego nieparzyste od nr 1 do nr 27, Portowa, Pusta, 6 Sierpnia nieparzyste od nr 1 do nr 43 i parzyste od nr 2 do nr 50, Staszica, Wąska, Wiejska."
"060000";"lubelskie";"061401";"Puławy";"urban commune";"3";"Zespół Szkół Katolickich, ul. Eustachiewicza 1, Puławy";"General";"No";"Eustachiewicza, Gdańska, Karpińskiego, Marszałka Piłsudskiego nieparzyste od nr 29 do nr 47, Polna 1, 1a."
"060000";"lubelskie";"061401";"Puławy";"urban commune";"4";"Szkoła Podstawowa Nr 2, Al. Mała 10, Puławy";"General";"No";"Aignera, Aleja Mała, Browarna, Czartoryskich, Głęboka, Księżnej Izabelli, Marszałka Piłsudskiego parzyste wszystkie i nieparzyste od, nr 49 do końca, Moniuszki, PCK , 4 Pułku Piechoty WP, Rybacka, Waryńskiego, Żulinki."
"060000";"lubelskie";"061401";"Puławy";"urban commune";"5";"Szkoła Podstawowa Nr 11, ul. Legionu Puławskiego 8, Puławy";"General";"No";"Generała Grota-Roweckiego nieparzyste, Legionu Puławskiego, Lessla, Lubelska 18, Na Stoku, 15 Pułku Piechoty ""Wilków""."
"060000";"lubelskie";"061401";"Puławy";"urban commune";"6";"Starostwo Powiatowe, Al. Królewska 19, Puławy";"General";"Yes";"Aleja Królewska, Baca, Baczyńskiego, Bielskiego, Broniewskiego, Brzozowa, Dębowa, Filtrowa nieparzyste do nr 3 i parzyste do nr 56a, , Gałczyńskiego, Gościńczyk parzyste od nr 12 do końca i nieparzyste od nr 35 do końca , Kazimierska nieparzyste od nr 1 do nr 21 i parzyste od nr 2 do nr 6a, Klonowa, Ppłk ""Konrada"", Kopecia, Kossakowskiego, , Kotarasińskiego, Krańcowa, Kruczkowskiego, Lewickiego, Lipowa, Malarskiego, Mieczyńskiego, Minkiewicza, Modrzewiowa, Okulickiego, , Parkowa, Sempołowskiej, Skowieszyńska, Szczypy, Szenwalda, Świerkowa, Zagrodzkiego, Zielona nieparzyste od nr 5 do końca, i parzyste od nr 16 do końca, Ziemięckiej, Żebrowskiego."
"060000";"lubelskie";"061401";"Puławy";"urban commune";"7";"Zespół Szkół Nr 3, ul. Marszałka Piłsudskiego 74, Puławy";"General";"No";"Cichockiego, Generała Fieldorfa ""Nila"", Grabskiego, Płk.Kujawskiego, Lubelska 10, Zielona nieparzyste od nr 1 do nr 3 i parzyste od nr 2 do nr 14A."
"060000";"lubelskie";"061401";"Puławy";"urban commune";"8";"Szkoła Podstawowa Nr 11, ul. Legionu Puławskiego 8, Puławy";"General";"No";"Filtrowa nieparzyste od nr 5 do końca i parzyste od nr 58 do końca, Generała Grota-Roweckiego parzyste, Gościńczyk nieparzyste od nr 1 do nr 33 i parzyste od nr 2 do nr 10a, Ogrodowa, Piramowicza."
"060000";"lubelskie";"061401";"Puławy";"urban commune";"9";"Szkoła Podstawowa Nr 4, ul. Zabłockiego 8, Puławy";"General";"Yes";"Blacharska, Generała Głowackiego, Generała Jasińskiego, Generała Madalińskiego, Jabłoniowa, Jaśminowa, Kazimierska parzyste od nr 8 do końca i nieparzyste od nr 23 do końca, Kilińskiego, Kowalska, Krzywa, Malarska, Malinowa, Miła, Mokra, Murarska, Piasecznica, Piękna, Polskiej Organizacji Wojskowej, Połaniecka, Powiśle, Racławicka, Słoneczna, Stolarska, Strzemskiego, Sybiraków, , Sypniewskiego, Ślusarska, Tokarska, Wiśniowa, Włostowicka, Zbożowa, Złotnicza."
"060000";"lubelskie";"061401";"Puławy";"urban commune";"10";"Szkoła Podstawowa Nr 4, ul. Zabłockiego 8, Puławy";"General";"Yes";"Ceglana, Czachowskiego, Emilii Plater, Frankowskiego, Generała Dwernickiego, Kaznowskiego, Koźmiana, Krahelskiej, Krasickiego, Krasińskiego, Langiewicza, Mierosławskiego, Naruszewicza, Norblina, , Padlewskiego, Powstańców Listopadowych, Romów, Sierakowskiego, Spokojna, Traugutta, Trembeckiego, Trześniaka, Woronicza, , Wysockiego, Zabłockiego."
"060000";"lubelskie";"061401";"Puławy";"urban commune";"11";"Szkoła Podstawowa Nr 11, ul. Legionu Puławskiego 8, Puławy";"General";"No";"Armii Krajowej, Armii Ludowej, Batalionów Chłopskich, Bernaciaka ""Orlika"", Botaniczna, Cicha, Cyprysowa, Generała Sikorskiego, , Irysowa, Kołodzieja, Kopernika, Kraussa, Księdza Adamczewskiego, Kwiatowa, Meresty, Miodowa, Opani, Pogodna, Pszczela, Romantyczna, Różana, Sadowa, Saperów Kaniowskich, Sosnowa, Spacerowa, Tęczowa, Tyczyńskiego, Urocza, Wodna, Wrzosowa, Zdebika."
"060000";"lubelskie";"061401";"Puławy";"urban commune";"12";"Zespół Szkół Ogólnokształcących Nr 1 im. Komisji Edukacji Narodowej, ul. Kaniowczyków 9, Puławy";"General";"Yes";"Amborskiego, Boskiej, Chmielowskiego, Dryi, Górna, Grzebalskiego, Hollakowej, Jakubickiego, Kaniowczyków nr 25, 27 i nr 42, Kędzierskiej, Kolejowa, Kosmali, Kotera, Krótka, Lubelska nieparzyste od nr 19 do końca i parzyste od nr 90 do końca, Norwida nieparzyste od nr 27 do końca i parzyste od nr 34 do końca, Okrzei, Ostrowskiego, Pałki, Pasiaka, Południowa, Poprzeczna, Północna, Renet-Jursz, Składowa, Słowackiego nieparzyste od nr 47 do końca, , Szalkiewiczowej, Szubartowskiego, Środkowa, Świgosta, Towarowa, Wolińskiej, Zinkiewicza."
"060000";"lubelskie";"061401";"Puławy";"urban commune";"13";"Zespół Szkół Technicznych, ul. Wojska Polskiego 7, Puławy";"General";"Yes";"Aleja Partyzantów parzyste od nr 2 do nr 16, Lubelska nieparzyste od nr 1 do nr 17, Norwida nieparzyste od nr 13 do nr 25 i parzyste od nr, 20 do nr 32, Wojska Polskiego."
"060000";"lubelskie";"061401";"Puławy";"urban commune";"14";"Szkoła Podstawowa Nr 1, ul. Kaniowczyków 1, Puławy";"General";"Yes";"Aleja Partyzantów parzyste od nr 18 do nr 28, Kaniowczyków nieparzyste od nr 1 do nr 23 i parzyste od nr 2 do nr 40, Norwida nieparzyste od nr 1 do nr 11 i parzyste od nr 2 do nr 18, Reymonta nieparzyste od nr 1 do nr 5 i parzyste od nr 2 do nr 6, Sieroszewskiego nieparzyste od nr 1 do nr 9 i parzyste od nr 2 do nr 18."
"060000";"lubelskie";"061401";"Puławy";"urban commune";"15";"Państwowa Szkoła Muzyczna I Stopnia, Al. Partyzantów 32, Puławy";"General";"No";"Aleja Partyzantów nieparzyste od nr 23 do końca i parzyste od nr 30 do końca, Arciucha, Dąbrowskiego, Grzegorzewskiej, Hauke-Bosaka, , Heindenreicha Kruka, Jaroszyńskiego, Kościuszki, Reja, Sowińskiego, Tysiąclecia Państwa Polskiego, Żeromskiego nieparzyste od nr 21 do końca i parzyste od nr 22 do końca, Żyrzyńska."
"060000";"lubelskie";"061401";"Puławy";"urban commune";"16";"Środowiskowy Dom Samopomocy, ul. Mickiewicza 2a, Puławy";"General";"Yes";"Dąbrowskiej, Kniaźnina, Konopnickiej, Kraszewskiego, Księdza Skargi, Księdza Ściegiennego, Mickiewicza, Nałkowskiej, Orzeszkowej, Reymonta nieparzyste od nr 7 do końca i parzyste od nr 8 do końca, Sienkiewicza nieparzyste od nr 21 do końca i parzyste od nr 20 do końca, Sieroszewskiego nieparzyste od nr 11 do końca i parzyste od nr 20 do końca, Słowackiego parzyste od nr 14 do końca i nieparzyste od nr 13 do nr 45, Tuwima."
"060000";"lubelskie";"061401";"Puławy";"urban commune";"17";"Środowiskowy Dom Samopomocy, ul. Mickiewicza 2a, Puławy";"General";"Yes";"Kochanowskiego, Sienkiewicza nieparzyste od nr 1 do nr 19 i parzyste od nr 2 do nr 18, Słowackiego nieparzyste od nr 1 do nr 11 i parzyste od nr 2 do nr 12, Żeromskiego nieparzyste od nr 1 do nr 19 i parzyste, od nr 2 do nr 20."
"060000";"lubelskie";"061401";"Puławy";"urban commune";"18";"POK ""Dom Chemika"", ul. Wojska Polskiego 4, Puławy";"General";"Yes";"Aleja Partyzantów nieparzyste od nr 3 do nr 11, Olszewskiego, Polna nieparzyste od nr 19 do końca."
"060000";"lubelskie";"061401";"Puławy";"urban commune";"19";"Zespół Szkół Nr 1, ul. Polna 18, Puławy";"General";"No";"Centralna, Polna nr 2, 3, 5, 6, 7, 9, 10, 14 do nr 18."
"060000";"lubelskie";"061401";"Puławy";"urban commune";"20";"Zespół Szkół Ogólnokształcących Nr 2, ul. Wróblewskiego 11, Puławy";"General";"No";"Aleja Partyzantów nieparzyste od nr 15 do nr 21, Czecha, Generała Bema, Kusocińskiego, Lokajskiego, Prusa, Wróblewskiego."
"060000";"lubelskie";"061401";"Puławy";"urban commune";"21";"Szkoła Podstawowa Nr 6, ul. Niemcewicza 4, Puławy";"General";"Yes";"Kowalskiego, Niemcewicza, Skłodowskiej-Curie."
"060000";"lubelskie";"061401";"Puławy";"urban commune";"22";"Szkoła Podstawowa Nr 3, ul. Jaworowa 5, Puławy";"General";"No";"Leśna nieparzyste od nr 15 do nr 33."
"060000";"lubelskie";"061401";"Puławy";"urban commune";"23";"Zespół Szkół Nr 2  ul. Jaworowa 1, Puławy";"General";"No";"Jaworowa, Kołłątaja parzyste od nr 28 do nr 52, Leśna nieparzyste od nr 1 do nr 13 i parzyste od nr 8 do końca, Piaskowa parzyste i nieparzyste od nr 1 do nr 61."
"060000";"lubelskie";"061401";"Puławy";"urban commune";"24";"Szpital Specjalistyczny, ul. Bema 1, Puławy";"Hospital";"Yes";"Samodzielny Publiczny Zakład Opieki Zdrowotnej w Puławach."
"060000";"lubelskie";"061409";"Puławy";"rural commune";"1";"Szkoła Podstawowa sala Nr 1, ul. Ogrodowa 18, Góra Puławska";"General";"No";"Góra Puławska"
"060000";"lubelskie";"061409";"Puławy";"rural commune";"2";"Szkoła Podstawowa sala Nr 2, ul. Ogrodowa 18,  Góra Puławska";"General";"No";"Kolonia Góra Puławska, Sadłowice, Tomaszów, Klikawa, Jaroszyn."
"060000";"lubelskie";"061409";"Puławy";"rural commune";"3";"Gminny Ośrodek Kultury sala Nr 1, ul. Folwarki 1, Gołąb";"General";"No";"Gołąb, Borowina, Matygi."
"060000";"lubelskie";"061409";"Puławy";"rural commune";"4";"Gminny Ośrodek Kultury sala Nr 2, ul. Folwarki 1, Gołąb";"General";"No";"Wólka Gołębska, Niebrzegów, Nieciecz."
"060000";"lubelskie";"061409";"Puławy";"rural commune";"5";"Szkoła Podstawowa, Borowa 9A";"General";"No";"Borowa, Skoki"
"060000";"lubelskie";"061409";"Puławy";"rural commune";"6";"Szkoła Podstawowa, Bronowice 148";"General";"No";"Bronowice, Łęka."
"060000";"lubelskie";"061409";"Puławy";"rural commune";"7";"Szkoła Podstawowa, Opatkowice 43";"General";"No";"Opatkowice, Kowala."
"060000";"lubelskie";"061409";"Puławy";"rural commune";"8";"Budynek Szkoły, Pachnowola 14";"General";"No";"Kajetanów, Pachnowola, Dobrosławów."
"060000";"lubelskie";"061409";"Puławy";"rural commune";"9";"Szkoła Podstawowa, Leokadiów 40";"General";"No";"Leokadiów, Smogorzów, Piskorów, Polesie."
"060000";"lubelskie";"061409";"Puławy";"rural commune";"10";"Szkoła Podstawowa, Zarzecze 1A";"General";"Yes";"Anielin, Zarzecze, Janów, Sosnów, Kochanów."
"060000";"lubelskie";"061410";"Wąwolnica";"rural commune";"1";"Szkoła Podstawowa, ul. Zamkowa 4, Wąwolnica";"General";"No";"Wąwolnica, Wąwolnica Kolonia, Łąki , Zarzeka"
"060000";"lubelskie";"061410";"Wąwolnica";"rural commune";"2";"Gimnazjum Publiczne, ul. Rynek 24A, Wąwolnica";"General";"Yes";"Huta, Kębło, Stanisławka, Bartłomiejowice, Mareczki, Łopatki Kolonia, Rogalów, Zgórzyńskie"
"060000";"lubelskie";"061410";"Wąwolnica";"rural commune";"3";"Szkoła Podstawowa, Karmanowice 85";"General";"No";"Celejów z wyłączeniem nr 68, Karmanowice, Łopatki"
"060000";"lubelskie";"061410";"Wąwolnica";"rural commune";"4";"Szkoła Podstawowa, Rąblów 65";"General";"No";"Rąblów, Grabówki, Zawada"
"060000";"lubelskie";"061410";"Wąwolnica";"rural commune";"5";"Zakład Opiekuńczo-Leczniczy dla Psychicznie i Nerwowo Chorych, Celejów 68";"General";"No";"Celejów Nr 68"
"060000";"lubelskie";"061411";"Żyrzyn";"rural commune";"1";"Klub Przedszkolaka, Bałtów 29";"General";"No";"Bałtów"
"060000";"lubelskie";"061411";"Żyrzyn";"rural commune";"2";"Szkoła Podstawowa, ul. Tysiąclecia 143, Żyrzyn";"General";"Yes";"Zagrody, Żyrzyn"
"060000";"lubelskie";"061411";"Żyrzyn";"rural commune";"3";"Szkoła Podstawowa, Osiny 235";"General";"No";"Osiny"
"060000";"lubelskie";"061411";"Żyrzyn";"rural commune";"4";"Szkoła Podstawowa, Skrudki 5A";"General";"No";"Jaworów, Parafianka, Skrudki, Wilczanka"
"060000";"lubelskie";"061411";"Żyrzyn";"rural commune";"5";"Szkoła Podstawowa, Kośmin 7";"General";"No";"Cezaryn, Kośmin, Strzyżowice"
"060000";"lubelskie";"061411";"Żyrzyn";"rural commune";"6";"Klub Przedszkolaka, Borysów 53";"General";"No";"Borysów"
"060000";"lubelskie";"061411";"Żyrzyn";"rural commune";"7";"Szkoła Podstawowa, Żerdź 91";"General";"No";"Żerdź"
"060000";"lubelskie";"061411";"Żyrzyn";"rural commune";"8";"Świetlica Wiejska, Kotliny 95";"General";"No";"Kotliny"
"060000";"lubelskie";"061411";"Żyrzyn";"rural commune";"9";"Klub Przedszkolaka, Wola Osińska 80";"General";"No";"Wola Osińska"
"060000";"lubelskie";"061502";"Borki";"rural commune";"1";"Szkoła Podstawowa w Borkach, ul. II Armii Wojska Polskiego 26,  Borki";"General";"Yes";"Borki, Olszwnica, Pasmugi, Sitno"
"060000";"lubelskie";"061502";"Borki";"rural commune";"2";"Szkoła Podstawowa w Krasewie, Krasew 84, Krasew";"General";"No";"Krasew, Wola Chomejowa"
"060000";"lubelskie";"061502";"Borki";"rural commune";"3";"Szkoła Podstawowa w Tchórzewie-Kolonii,Tchórzew-Kolonia 186, Tchórzew-Kolonia";"General";"No";"Tchórzew-Kolonia"
"060000";"lubelskie";"061502";"Borki";"rural commune";"4";"Gminny Ośrodek Kultury w Woli Osowińskiej,ul. Wesoła 29, Wola Osowińska";"General";"No";"Nowiny, Osowno, Wola Osowińska"
"060000";"lubelskie";"061502";"Borki";"rural commune";"5";"Remiza OSP w Starej Wsi, Stara Wieś 33A, Stara Wieś";"General";"No";"Maruszewiec Nowy, Maruszewiec Stary, Stara Wieś, Tchórzew, Wrzosów"
"060000";"lubelskie";"061503";"Czemierniki";"rural commune";"1";"Szkoła Podstawowa im.Tadeusza Kościuszki w Czemiernikach, ul. Kocka 45, Czemierniki";"General";"Yes";"Czemierniki Skoki Wygnanów"
"060000";"lubelskie";"061503";"Czemierniki";"rural commune";"2";"Budynek Ochotniczej Straży Pożarnej w Bełczącu, Bełcząc 187, Bełcząc";"General";"No";"Bełcząc"
"060000";"lubelskie";"061503";"Czemierniki";"rural commune";"3";"Budynek po byłej Szkole Podstawowej w Stoczku, Stoczek 50, Stoczek";"General";"No";"Stoczek Stójka"
"060000";"lubelskie";"061503";"Czemierniki";"rural commune";"4";"Szkoła Podstawowa w Niewęgłoszu, Niewęgłosz 43, Niewęgłosz";"General";"No";"Lichty Niewęgłosz"
