"180000";"podkarpackie";"181303";"Fredropol";"rural commune";"13";"Dom Pomocy Społecznej, Huwniki";"Social help centre";"Yes";"Dom Pomocy Społecznej w Huwnikach"
"180000";"podkarpackie";"181304";"Krasiczyn";"rural commune";"1";"Gminny Ośrodek Kultury w Krasiczynie, 37-741 Krasiczyn";"General";"Yes";"Dybawka, Krasiczyn, Śliwnica"
"180000";"podkarpackie";"181304";"Krasiczyn";"rural commune";"2";"Świetlica Wiejska w Prałkowcach, 37-700 Przemyśl";"General";"No";"Prałkowce"
"180000";"podkarpackie";"181304";"Krasiczyn";"rural commune";"3";"Świetlica Wiejska w Olszanach, 37-741 Krasiczyn";"General";"No";"Zalesie, Rokszyce, Brylińce, Chołowice, Mielnów, Krasice, Krzeczkowa, Cisowa, Olszany"
"180000";"podkarpackie";"181304";"Krasiczyn";"rural commune";"4";"Świetlica Warsztatów Terapii Zajęciowej w Korytnikach, 37-741 Krasiczyn";"General";"No";"Korytniki"
"180000";"podkarpackie";"181304";"Krasiczyn";"rural commune";"5";"Świetlica Wiejska w Tarnawcach, 37-741 Krasiczyn";"General";"No";"Tarnawce"
"180000";"podkarpackie";"181305";"Krzywcza";"rural commune";"1";"Gminne Centrum Kultury w Babicach, 37-754 Babice";"General";"No";"Babice"
"180000";"podkarpackie";"181305";"Krzywcza";"rural commune";"2";"Świetlica Wiejska w Bachowie, 37-754 Babice";"General";"Yes";"Bachów"
"180000";"podkarpackie";"181305";"Krzywcza";"rural commune";"3";"Świetlica Wiejska w Krzywczy, 37-755 Krzywcza";"General";"No";"Krzywcza, Chyrzyna, Kupna, Ruszelczyce, Wola Krzywiecka"
"180000";"podkarpackie";"181305";"Krzywcza";"rural commune";"4";"Świetlica Wiejska w Reczpolu, 37-755 Krzywcza";"General";"No";"Reczpol"
"180000";"podkarpackie";"181305";"Krzywcza";"rural commune";"5";"Świetlica Wiejska w Skopowie, 37-754 Babice";"General";"No";"Skopów"
"180000";"podkarpackie";"181305";"Krzywcza";"rural commune";"6";"Świetlica Wiejska w Średniej, 37-755 Krzywcza";"General";"No";"Średnia"
"180000";"podkarpackie";"181306";"Medyka";"rural commune";"1";"Urząd Gminy Medyka, 37-732 Medyka";"General";"No";"Sołectwo Medyka"
"180000";"podkarpackie";"181306";"Medyka";"rural commune";"2";"Szkoła Podstawowa w Siedliskach, 37-705 Przemyśl 7";"General";"No";"Sołectwo Siedliska"
"180000";"podkarpackie";"181306";"Medyka";"rural commune";"3";"Szkoła Podstawowa w Lesznie, 37-723 Stubno";"General";"No";"Sołectwo Leszno"
"180000";"podkarpackie";"181306";"Medyka";"rural commune";"4";"Szkoła Podstawowa w Torkach, 37-732 Medyka";"General";"Yes";"Sołectwo Torki"
"180000";"podkarpackie";"181306";"Medyka";"rural commune";"5";"Remiza OSP w Hurku, 37-705 Przemyśl 7";"General";"No";"Sołectwo Hurko"
"180000";"podkarpackie";"181306";"Medyka";"rural commune";"6";"Szkoła Podstawowa w Hureczku, 37-705 Przemyśl 7";"General";"No";"Sołectwo Hureczko"
"180000";"podkarpackie";"181306";"Medyka";"rural commune";"7";"Świetlica Wiejska w Jaksmanicach, 37-705 Przemyśl 7";"General";"No";"Sołectwo Jaksmanice"
"180000";"podkarpackie";"181307";"Orły";"rural commune";"1";"Dom Ludowy w Orłach, 37-716 Orły";"General";"No";"Sołectwo Orły"
"180000";"podkarpackie";"181307";"Orły";"rural commune";"2";"Dom Strażaka w Nizinach, 37-716 Orły";"General";"No";"Sołectwo Niziny"
"180000";"podkarpackie";"181307";"Orły";"rural commune";"3";"Dom Ludowy w Wacławicach, 37-717 Kaszyce";"General";"No";"Sołectwa : Trójczyce, Wacławice"
"180000";"podkarpackie";"181307";"Orły";"rural commune";"4";"Szkoła Podstawowa w Kaszycach, 37-717 Kaszyce";"General";"No";"Sołectwa : Ciemięrzowice, Kaszyce, Olszynka"
"180000";"podkarpackie";"181307";"Orły";"rural commune";"5";"Dom Ludowy w Drohojowie, 37-716 Orły";"General";"No";"Sołectwo Drohojów"
"180000";"podkarpackie";"181307";"Orły";"rural commune";"6";"Dom Ludowy w Zadąbrowiu, 37-716 Orły";"General";"No";"Sołectwo Zadąbrowie"
"180000";"podkarpackie";"181307";"Orły";"rural commune";"7";"Dom Ludowy w Małkowicach, 37-716 Orły";"General";"No";"Sołectwo Małkowice"
"180000";"podkarpackie";"181307";"Orły";"rural commune";"8";"Dom Ludowy w Walawie, 37-716 Orły";"General";"Yes";"Sołectwo Walawa"
"180000";"podkarpackie";"181307";"Orły";"rural commune";"9";"Dom Ludowy w Hnatkowicach, 37-717 Kaszyce";"General";"No";"Sołectwo Hnatkowice"
"180000";"podkarpackie";"181307";"Orły";"rural commune";"10";"Dom Ludowy w Duńkowiczkach, 37-716 Orły";"General";"No";"Sołectwo Duńkowiczki"
"180000";"podkarpackie";"181308";"Przemyśl";"rural commune";"1";"Szkoła Podstawowa w Krównikach, 37-700 Przemyśl";"General";"Yes";"Krówniki, Łuczyce, Rożubowice"
"180000";"podkarpackie";"181308";"Przemyśl";"rural commune";"2";"Szkoła Podstawowa w Hermanowicach, 37-733 Pikulice";"General";"No";"Hermanowice, Malhowice, Stanisławczyk"
"180000";"podkarpackie";"181308";"Przemyśl";"rural commune";"3";"Szkoła Podstawowa w Nehrybce, 37-733 Pikulice";"General";"No";"Nehrybka, Pikulice"
"180000";"podkarpackie";"181308";"Przemyśl";"rural commune";"4";"Szkoła Podstawowa w Grochowcach, 37-733 Pikulice";"General";"No";"Grochowce, Witoszyńce"
"180000";"podkarpackie";"181308";"Przemyśl";"rural commune";"5";"Gminne Centrum Informacji w Kuńkowcach, 37-700 Przemyśl";"General";"No";"Bełwin, Kuńkowce, Łętownia, Wapowce"
"180000";"podkarpackie";"181308";"Przemyśl";"rural commune";"6";"Szkoła Podstawowa w Ostrowie, 37-700 Przemyśl";"General";"No";"Ostrów"
"180000";"podkarpackie";"181308";"Przemyśl";"rural commune";"7";"Szkoła Podstawowa w Ujkowicach, 37-713 Maćkowice";"General";"No";"Ujkowice"
"180000";"podkarpackie";"181309";"Stubno";"rural commune";"1";"Świetlica wiejska w Gajach, 37-724 Kalników";"General";"No";"Sołectwo Gaje Sołectwo Hruszowice"
"180000";"podkarpackie";"181309";"Stubno";"rural commune";"2";"Szkoła Podstawowa w Kalnikowie, 37-724 Kalników";"General";"No";"Sołectwo Kalników"
"180000";"podkarpackie";"181309";"Stubno";"rural commune";"3";"Świetlica wiejska w Nakle, 37-723 Stubno";"General";"Yes";"Sołectwo Nakło Sołectwo Starzawa"
"180000";"podkarpackie";"181309";"Stubno";"rural commune";"4";"Sala narad Urzędu Gminy Stubno, 37-723 Stubno";"General";"No";"Sołectwo Stubno"
"180000";"podkarpackie";"181309";"Stubno";"rural commune";"5";"Świetlica wiejska w Stubienku, 37-723 Stubno";"General";"No";"Sołectwo Barycz Sołectwo Stubienko"
"180000";"podkarpackie";"181310";"Żurawica";"rural commune";"1";"Dom Ludowy w Batyczach, 37-713 Maćkowice";"General";"No";"sołectwo Batycze"
"180000";"podkarpackie";"181310";"Żurawica";"rural commune";"2";"Szkoła Podstawowa w Bolestraszycach, 37-722 Wyszatyce";"General";"No";"sołectwo Bolestraszyce"
"180000";"podkarpackie";"181310";"Żurawica";"rural commune";"3";"Szkoła Podstawowa w Buszkowicach, 37-710 Żurawica";"General";"No";"sołectwo Buszkowice"
"180000";"podkarpackie";"181310";"Żurawica";"rural commune";"4";"Dom Ludowy w Buszkowiczkach, 37-710 Żurawica";"General";"No";"sołectwo Buszkowiczki"
"180000";"podkarpackie";"181310";"Żurawica";"rural commune";"5";"Dom Ludowy w Kosienicach, 37-713 Maćkowice";"General";"No";"sołectwo Kosienice"
"180000";"podkarpackie";"181310";"Żurawica";"rural commune";"6";"Dom Ludowy - świetlica w Maćkowicach, 37-713 Maćkowice";"General";"No";"sołectwo Maćkowice"
"180000";"podkarpackie";"181310";"Żurawica";"rural commune";"7";"Dom Ludowy w Orzechowcach, 37-712 Orzechowce";"General";"No";"sołectwo Orzechowce"
"180000";"podkarpackie";"181310";"Żurawica";"rural commune";"8";"Dom Ludowy w Wyszatycach, 37-722 Wyszatyce";"General";"No";"sołectwo Wyszatyce"
"180000";"podkarpackie";"181310";"Żurawica";"rural commune";"9";"Urząd Gminy w Żurawicy, ul. Ojca Św. Jana Pawla II 1, 37-710 Żurawica";"General";"Yes";"sołectwo Żurawica - ulice: Ojca Św.Jana Pawła II, Sportowa, Marcina Króla, 2 Pułku Pancernego, Leliwitów, Odrowążów, Lubomirskich, Sapiehów, Stanisława Orzechowskiego, Jagiellonów, Mikołaja Kopernika, Karola Franciszka Korniakta, Forteczna, Armii Krajowej, Gen. Jakuba Jasińskiego, Adama Mickiewicza, Przemyska (nr nieparzyste), Rzeszowska (nr parzyste), "
"180000";"podkarpackie";"181310";"Żurawica";"rural commune";"10";"Polski Dom Katolicki w Żurawicy, ul. Wojska Polskiego 1, 37-710 Żurawica";"General";"No";"sołectwo Żurawica -ulice: Kolejowa, Dworcowa, Bankowa, Owocowa, Ogrodowa, Kwiatowa, Piotra Michałowskiego, Jana Matejki, Stanisława Wyspiańskiego, Stefana Żeromskiego, Bolesława Prusa, Gen. K. Sosnkowskiego, Marszałka Józefa Piłsudskiego, Gen. Władysława Andersa, Fryderyka Chopina, Gen. Władysława Sikorskiego, Bernarda Wapowskiego, Wojska Polskiego, I Dywizji Pancernej, Gen. Stanisława Maczka, Św. Józefa, Stefana Czarnieckiego, Gen. Grota Roweckiego, Płk Stanisława Koszutskiego, Płk Józefa Koczwary, Polna, Władysława Reymonta, "
"180000";"podkarpackie";"181310";"Żurawica";"rural commune";"11";"Szkoła Podstawowa Nr 2 w Żurawicy, 37-710 Żurawica";"General";"Yes";"sołectwo Żurawica - ulice: Przemyska (nr parzyste), Rzeszowska (nr nieparzyste), Tadeusza Kościuszki, 3-go Maja, Słoneczna, Wincentego Witosa, Wiosenna, Macieja Rataja, Henryka Sienkiewicza, Aleksandra Fredry, Kardynała Stefana Wyszyńskiego, Różana, Pruchnicka, Żurawia, Dworska, Kasztanowa, Leśna, Pogodna, Szańcowa, Bażantowa, Jastrzębia, Geodetów"
"180000";"podkarpackie";"181402";"Adamówka";"rural commune";"1";"Szkoła Podstawowa w Adamówce, 37-534 Adamówka";"General";"Yes";"Sołectwo: Adamówka wraz z Osiedlem Mieszkaniowym"
"180000";"podkarpackie";"181402";"Adamówka";"rural commune";"2";"Szkoła Podstawowa w Cieplicach, 37-534 Adamówka";"General";"No";"Sołectwo : Cieplice wraz z Osiedlem ""Izabelin"""
"180000";"podkarpackie";"181402";"Adamówka";"rural commune";"3";"Szkoła Podstawowa w Majdanie Sieniawskim, 37-534 Adamówka";"General";"No";"Sołectwo : Majdan Sieniawski"
"180000";"podkarpackie";"181402";"Adamówka";"rural commune";"4";"Szkoła Podstawowa w Krasnem, 37-534 Adamówka";"General";"No";"Sołectwo : Krasne, Pawłowa, Dobcza"
"180000";"podkarpackie";"181403";"Gać";"rural commune";"1";"Gminny Ośrodek Kultury w Gaci, 37-207 Gać";"General";"No";"Gać"
"180000";"podkarpackie";"181403";"Gać";"rural commune";"2";"Szkoła Podstawowa w Ostrowie, 37-207 Gać";"General";"No";"Ostrów, Wolica"
"180000";"podkarpackie";"181403";"Gać";"rural commune";"3";"Zespół Szkół w Dębowie, 37-200 Przeworsk";"General";"No";"Dębów"
"180000";"podkarpackie";"181403";"Gać";"rural commune";"4";"Dom Ludowy w Białobokach, 37-207 Gać";"General";"Yes";"Białoboki"
"180000";"podkarpackie";"181403";"Gać";"rural commune";"5";"Szkoła Podstawowa w Mikulicach, 37-220 Kańczuga";"General";"No";"Mikulice"
"180000";"podkarpackie";"181404";"Jawornik Polski";"rural commune";"1";"Sala narad Urzędu Gminy Jawornik Polski 30, 37-232 Jawornik Polski";"General";"No";"Jawornik Polski, Jawornik Przedmieście, Widaczów"
"180000";"podkarpackie";"181404";"Jawornik Polski";"rural commune";"2";"Remiza OSP Hadle Szklarskie, Hadle Szklarskie 62, 37-232 Jawornik Polski";"General";"No";"Hadle Szklarskie, Hadle Kańczuckie"
"180000";"podkarpackie";"181404";"Jawornik Polski";"rural commune";"3";"Remiza OSP Hucisko Jawornickie 267, 37-230 Manasterz";"General";"No";"Hucisko Jawornickie"
"180000";"podkarpackie";"181404";"Jawornik Polski";"rural commune";"4";"Zespół Szkół Nr 2 w Manasterzu, Manasterz 575, 37-230 Manasterz";"General";"Yes";"Manasterz, Zagórze"
"180000";"podkarpackie";"181405";"Kańczuga";"rural area in urban-rural commune";"1";"Ośrodek Kultury Miasta i Gminy w Kańczudze, ul. Parkowa 1A";"General";"No";"Miasto Kańczuga, ulice: 3 Maja, Kościuszki, Kwiatowa, Mickiewicza, Polna, Rynek, Sawickiego, Słowackiego, Św. Barbary, Wincentego Witosa"
"180000";"podkarpackie";"181405";"Kańczuga";"rural area in urban-rural commune";"2";"Zespół Szkolno - Gimnazjalny w Krzeczowicach, Krzeczowice 56A";"General";"No";"Sołectwa: Bóbrka Kańczucka, Krzeczowice"
"180000";"podkarpackie";"181405";"Kańczuga";"rural area in urban-rural commune";"3";"Dom Kultury w Łopuszce Wielkiej, Łopuszka Wielka 134";"General";"Yes";"Sołectwa: Łopuszka Wielka, Medynia Kańczucka"
"180000";"podkarpackie";"181405";"Kańczuga";"rural area in urban-rural commune";"4";"Zespół Szkolno - Gimnazjalny w Pantalowicach, Pantalowice 158";"General";"No";"Sołectwo: Pantalowice"
"180000";"podkarpackie";"181405";"Kańczuga";"rural area in urban-rural commune";"5";"Zespół Szkolno - Gimnazjalny w Rączynie, Rączyna 146";"General";"No";"Sołectwa: Rączyna, Wola Rzeplińska"
"180000";"podkarpackie";"181405";"Kańczuga";"rural area in urban-rural commune";"6";"Dom Strażaka w Sieteszy, Sietesz 286";"General";"Yes";"Sołectwa: Chodakówka, Lipnik, Sietesz"
"180000";"podkarpackie";"181405";"Kańczuga";"rural area in urban-rural commune";"7";"Zespół Szkolno - Gimnazjalny w Siedleczce, Siedleczka 179";"General";"No";"Sołectwo: Siedleczka"
"180000";"podkarpackie";"181405";"Kańczuga";"rural area in urban-rural commune";"8";"Szkoła Podstawowa w Kańczudze, ul. Szkolna 7";"General";"No";"Sołectwa: Łopuszka Mała, Niżatyce, Żuklin"
"180000";"podkarpackie";"181405";"Kańczuga";"rural area in urban-rural commune";"9";"Hala Sportowa w Kańczudze, ul. Parkowa 10";"General";"Yes";"Miasto Kańczuga, ulice: 11 Listopada, 15 Sierpnia, Adama Głowackiego Bohaterów Westerplatte, Bolesława Płachcińskiego, Grunwaldzka, Generała M. Karaszewicza-Tokarzewskiego, Kochanowskiego, Kolejowa, Leona Grzebyka, Leopolda Okulickiego, Lisa Kuli, Konopnickiej, Marszałka Józefa Piłsudskiego, Parkowa, Słoneczna, Sportowa, Szkolna, Węgierska, Władysława Kojdra, Wolności, Zakościelna, Zielona."
"180000";"podkarpackie";"181406";"Przeworsk";"rural commune";"1";"Zespół Szkół w Chałupki";"General";"Yes";"Sołectwo Chałupki i Gorliczyna Szewnia"
"180000";"podkarpackie";"181406";"Przeworsk";"rural commune";"2";"Gimnazjum Nr 5 Gorliczyna";"General";"No";"Sołectwo Gorliczyna"
"180000";"podkarpackie";"181406";"Przeworsk";"rural commune";"3";"Wiejski Dom Kultury Grzęska";"General";"No";"Sołectwo Grzęska"
"180000";"podkarpackie";"181406";"Przeworsk";"rural commune";"4";"Wiejski Dom Kultury Gwizdaj";"General";"No";"Sołectwo Gwizdaj"
"180000";"podkarpackie";"181406";"Przeworsk";"rural commune";"5";"Remiza OSP Mirocin";"General";"No";"Sołectwo Mirocin"
"180000";"podkarpackie";"181406";"Przeworsk";"rural commune";"6";"Remiza OSP Nowosielce";"General";"No";"Sołectwo Nowosielce"
"180000";"podkarpackie";"181406";"Przeworsk";"rural commune";"7";"Remiza OSP Rozbórz";"General";"No";"Sołectwo Rozbórz"
"180000";"podkarpackie";"181406";"Przeworsk";"rural commune";"8";"Remiza OSP Studzian";"General";"No";"Sołectwo Studzian"
"180000";"podkarpackie";"181406";"Przeworsk";"rural commune";"9";"Wiejski Dom Kultury Świętoniowa";"General";"No";"Sołectwo Świętoniowa"
"180000";"podkarpackie";"181406";"Przeworsk";"rural commune";"10";"Remiza OSP Ujezna";"General";"No";"Sołectwo Ujezna"
"180000";"podkarpackie";"181406";"Przeworsk";"rural commune";"11";"Zespół Szkół Urzejowice";"General";"No";"Sołectwo Urzejowice"
"180000";"podkarpackie";"181401";"Przeworsk";"urban commune";"1";"Urząd Miasta Przeworska, ul. Jagiellońska 10, Przeworsk";"General";"Yes";"Browarna, Grochowa, Jesionowa, Jagiellońska, Kasztanowa, Konopnickiej bloki nr 4, 8, 10, Krakowska, Miodowa, Nad Stawem, Niepodległości, Osiedle Jana III Sobieskiego, Osiedle Poniatowskiego, Park, Plac Chopina, Plac Jana Pawła II, Pod Parkiem, Rzeczna, Stefana Batorego, Studziańska, Warzywna, Witosa, Wodna, Żytnia."
"180000";"podkarpackie";"181401";"Przeworsk";"urban commune";"2";"Zespół Szkół Ogólnokształcących i Zawodowych, ul. Szkolna 6 Przeworsk";"General";"No";"Generała Sikorskiego, Korczaka, Łańcucka, Łukasiewicza, Sienkiewicza, Szpitalna, Wołodyjowskiego, Zagłoby"
"180000";"podkarpackie";"181401";"Przeworsk";"urban commune";"3";"Szkoła Podstawowa Nr 1, ul. M. Konopnickiej 5, Przeworsk";"General";"No";"Budowlanych, Curie-Skłodowskiej, Gorliczyńska (do wiaduktu kolejowego), Konopnickiej, Konopnickiej bloki nr 3, 7, 9, 11, 13, 17, 19, 23, 25, Tysiąclecia"
"180000";"podkarpackie";"181401";"Przeworsk";"urban commune";"4";"Ratusz, ul. Rynek 1, Przeworsk";"General";"No";"Bernardyńska, Cicha, Gimnazjalna, Grunwaldzka, Jasna, Kasprowicza, Kazimierzowska, Kąty, Kilińskiego, Koczocika, Kościelna, Kościuszki, Kręta, Krótka, Księdza Prałata Adama Ablewicza, Lwowska do numeru 22, Marszałka Piłsudskiego, Ogrodowa, Plac Mickiewicza, Polna, Reymonta, Rynek, Słowackiego, Stolarska, Stepkiewicza, Szkolna, Świętego Jana, Tatarska, Tkacka, Wałowa, Wąska, Wierzbowa, Zamknięta, Zielona, Zygmuntowska"
"180000";"podkarpackie";"181401";"Przeworsk";"urban commune";"5";"Gimnazjum Nr 1, ul. Misiągiewicza 10, Przeworsk";"General";"Yes";"11 Listopada, Kwietna, Lipowa, Lwowska od numeru 23, Mikołaja Kopernika, Misiągiewicza, Orląt Lwowskich, Osiedle Józefa Benbenka, Otwarta, Pod Rozborzem, Pogodna, Pszenna, Pułkownika Rolskiego, Rolna, Rzemieślnicza, Słoneczna, Staropocztowa, Sportowa"
"180000";"podkarpackie";"181401";"Przeworsk";"urban commune";"6";"Zespół Szkół Zawodowych, ul. I. Krasickiego 9, Przeworsk";"General";"No";"3 Maja, Dworcowa, Dynowska, Głęboka, Kołłątaja, Ignacego Krasickiego, Królowej Jadwigi, Lubomirskich, Okopowa, Staszica"
"180000";"podkarpackie";"181401";"Przeworsk";"urban commune";"7";"Szkoła Podstawowa Nr 3, ul. Gorliczyńska 148, Przeworsk";"General";"No";"Armii Krajowej, Długa, Gorliczyńska (od wiaduktu kolejowego), Jedności, Łąkowa, Mostowa, Solarza."
"180000";"podkarpackie";"181401";"Przeworsk";"urban commune";"8";"Nauczycielskie Kolegium Języków Obcych, ul. Gimnazjalna 35, Przeworsk";"General";"No";"Aleksandrów, Czarnieckiego, Klonowa, Wojska Polskiego"
"180000";"podkarpackie";"181401";"Przeworsk";"urban commune";"9";"Miejski Klub Kultury, ul. Wiejska 68";"General";"No";"Krzywa, Węgierska, Wiejska, Żurawia"
"180000";"podkarpackie";"181401";"Przeworsk";"urban commune";"10";"Szkoła Podstawowa Nr 1 ul.M.Konopnickiej 5, Przeworsk";"General";"No";"Dobra, Generała Andersa, Generała Chruściela, Pod Chałupkami, Wiśniowa, Wspólna, Za Parowozownią."
"180000";"podkarpackie";"181401";"Przeworsk";"urban commune";"11";"SP Zakład Opieki Zdrowotnej, ul. Szpitalna 16, 37-200 Przeworsk";"Hospital";"Yes";"Samodzielny Publiczny Zakład Opieki Zdrowotnej"
"180000";"podkarpackie";"181407";"Sieniawa";"rural area in urban-rural commune";"1";"Remizo-świetlica w Czercach, 37-530 Sieniawa";"General";"No";"sołectwo Czerce"
"180000";"podkarpackie";"181407";"Sieniawa";"rural area in urban-rural commune";"2";"Remizo-świetlica w Czerwonej Woli, 37-530 Sieniawa";"General";"No";"sołectwo Czerwona Wola"
"180000";"podkarpackie";"181407";"Sieniawa";"rural area in urban-rural commune";"3";"Szkoła Podstawowa w Dobrej, 37-530 Sieniawa";"General";"No";"sołectwo Dobra"
"180000";"podkarpackie";"181407";"Sieniawa";"rural area in urban-rural commune";"4";"Remizo-świetlica w Dybkowie, 37-530 Sieniawa";"General";"No";"Sołectwo Dybków"
"180000";"podkarpackie";"181407";"Sieniawa";"rural area in urban-rural commune";"5";"Dom Ludowy w Leżachowie,  37-530 Sieniawa";"General";"No";"sołectwo Leżachów"
"180000";"podkarpackie";"181407";"Sieniawa";"rural area in urban-rural commune";"6";"Dom Ludowy  w Piganach, 37-530 Sieniawa";"General";"No";"sołectwo Pigany, sołectwo Paluchy"
"180000";"podkarpackie";"181407";"Sieniawa";"rural area in urban-rural commune";"7";"Remizo - świetlica w Rudce, 37-530 Sieniawa";"General";"No";"sołectwo Rudka"
"180000";"podkarpackie";"181407";"Sieniawa";"rural area in urban-rural commune";"8";"Szkoła Podstawowa w Sieniawie";"General";"Yes";"Miasto Sieniawa"
"180000";"podkarpackie";"181407";"Sieniawa";"rural area in urban-rural commune";"9";"Remizo-świetlica w Wylewie , 37-530 Sieniawa";"General";"No";"Sołectwo Wylewa"
"180000";"podkarpackie";"181408";"Tryńcza";"rural commune";"1";"Zespół Szkół w Tryńczy, 37-204 Tryńcza";"General";"Yes";"Tryńcza, Wólka Małkowa, Wólka Ogryzkowa"
"180000";"podkarpackie";"181408";"Tryńcza";"rural commune";"2";"Wiejski Dom Kultury Gorzyce, 37-204 Tryńcza";"General";"No";"Gorzyce"
"180000";"podkarpackie";"181408";"Tryńcza";"rural commune";"3";"Wiejski Dom Kultury w Gniewczynie Łańcuckiej, 37-203 Gniewczyna Łańcucka";"General";"No";"Gniewczyna Łańcucka"
"180000";"podkarpackie";"181408";"Tryńcza";"rural commune";"4";"Zespół Szkoły i Przedszkola w Jagielle, 37-203 Gniewczyna Łańcucka";"General";"No";"Jagiełła"
"180000";"podkarpackie";"181408";"Tryńcza";"rural commune";"5";"Wiejski Dom Kultury w Głogowcu, 37-204 Tryńcza";"General";"No";"Głogowiec"
"180000";"podkarpackie";"181408";"Tryńcza";"rural commune";"6";"Wiejski Dom Kultury w Gniewczynie Trynieckiej, 37-203 Gniewczyna Łańcucka";"General";"No";"Gniewczyna Tryniecka"
"180000";"podkarpackie";"181408";"Tryńcza";"rural commune";"7";"Szkoła Podstawowa w Ubieszynie, 37-204 Tryńcza";"General";"No";"Ubieszyn"
"180000";"podkarpackie";"181409";"Zarzecze";"rural commune";"1";"Szkoła Podstawowa /nowy budynek/ Zarzecze , 37-205 Zarzecze";"General";"Yes";"Zarzecze wieś i osiedle"
"180000";"podkarpackie";"181409";"Zarzecze";"rural commune";"2";"Szkoła Podstawowa Siennów , 37-205 Zarzecze";"General";"No";"Siennów"
"180000";"podkarpackie";"181409";"Zarzecze";"rural commune";"3";"Szkoła Podstawowa Żurawiczki, 37-200 Przeworsk";"General";"No";"Żurawiczki"
"180000";"podkarpackie";"181409";"Zarzecze";"rural commune";"4";"Szkoła Podstawowa Maćkówka, 37-200 Przeworsk";"General";"No";"Maćkówka"
"180000";"podkarpackie";"181409";"Zarzecze";"rural commune";"5";"Szkoła Podstawowa Pełnatycze, 37-205 Zarzecze";"General";"No";"Pełnatycze"
"180000";"podkarpackie";"181409";"Zarzecze";"rural commune";"6";"Szkoła Podstawowa Rożniatów, 37-205 Zarzecze";"General";"No";"Rożniatów"
"180000";"podkarpackie";"181409";"Zarzecze";"rural commune";"7";"Remiza OSP Zalesie, 37-205 Zarzecze";"General";"No";"Zalesie"
"180000";"podkarpackie";"181409";"Zarzecze";"rural commune";"8";"Szkoła Podstawowa Kisielów, 37-205 Zarzecze";"General";"No";"Kisielów"
"180000";"podkarpackie";"181409";"Zarzecze";"rural commune";"9";"Remiza OSP Łapajówka, 37-205 Zarzecze";"General";"No";"Łapajówka"
"180000";"podkarpackie";"181501";"Iwierzyce";"rural commune";"1";"Zespół Szkół w Iwierzycach, Iwierzyce 188, Iwierzyce";"General";"Yes";"Sołectwo Iwierzyce."
"180000";"podkarpackie";"181501";"Iwierzyce";"rural commune";"2";"Szkoła Podstawowa w Sielcu, Sielec 51 B, Sielec";"General";"No";"Sołectwo Sielec."
"180000";"podkarpackie";"181501";"Iwierzyce";"rural commune";"3";"Szkoła Podstawowa w Olchowej, Olchowa 3, Olchowa";"General";"No";"Sołectwo Olchowa"
"180000";"podkarpackie";"181501";"Iwierzyce";"rural commune";"4";"Szkoła Podstawowa w Nockowej, Nockowa 1, Nockowa";"General";"No";"Sołectwo Nockowa."
"180000";"podkarpackie";"181501";"Iwierzyce";"rural commune";"5";"Szkoła Podstawowa w Będzienicy, Będzienica 44, Będzienica";"General";"No";"Sołectwo Będzienica."
"180000";"podkarpackie";"181501";"Iwierzyce";"rural commune";"6";"Szkoła Podstawowa w Wiśniowej, Wiśniowa 69, Wiśniowa";"General";"No";"Sołectwo Wiśniowa."
"180000";"podkarpackie";"181501";"Iwierzyce";"rural commune";"7";"Szkoła Podstawowa w Bystrzycy, Bystrzyca 52 A, Bystrzyca";"General";"No";"Sołectwo Bystrzyca."
"180000";"podkarpackie";"181501";"Iwierzyce";"rural commune";"8";"Dom Strażaka w Olimpowie, Olimpów 57, Olimpów";"General";"No";"Sołectwo Olimpów."
"180000";"podkarpackie";"181501";"Iwierzyce";"rural commune";"9";"Szkoła Podstwowa w Wiercanach, Wiercany 73, Wiercany";"General";"No";"Sołectwo Wiercany."
"180000";"podkarpackie";"181502";"Ostrów";"rural commune";"1";"Dom Strażaka w Ostrowie, Ostrów 224, Ostrów";"General";"Yes";"Sołectwo Ostrów"
"180000";"podkarpackie";"181502";"Ostrów";"rural commune";"2";"Szkoła Podstawowa w Skrzyszowie, Skrzyszów 190, Skrzyszów";"General";"No";"Sołectwo Skrzyszów"
"180000";"podkarpackie";"181502";"Ostrów";"rural commune";"3";"Szkoła Podstawowa w Woli Ocieckiej, Wola Ociecka 114, Wola Ociecka";"General";"No";"Sołectwo Wola Ociecka"
"180000";"podkarpackie";"181502";"Ostrów";"rural commune";"4";"Wiejski Ośrodek Kultury w Bliźnie, Blizna 68, Blizna";"General";"No";"Sołectwo Blizna"
"180000";"podkarpackie";"181502";"Ostrów";"rural commune";"5";"Szkoła Podstawowa w Ociece, Ocieka 352, Ocieka";"General";"No";"Sołectwo Ocieka"
"180000";"podkarpackie";"181502";"Ostrów";"rural commune";"6";"Szkoła Podstawowa w Kamionce, Kamionka 206, Kamionka";"General";"No";"Sołectwo Kamionka"
"180000";"podkarpackie";"181502";"Ostrów";"rural commune";"7";"Szkoła Podstawowa w Zdżarach, Zdżary 59, Zdżary";"General";"No";"Sołectwo Zdżary"
"180000";"podkarpackie";"181502";"Ostrów";"rural commune";"8";"Szkoła Podstawowa w Kozodrzy, Kozodrza 175, Kozodrza";"General";"No";"Sołectwo Kozodrza, Borek Mały"
"180000";"podkarpackie";"181503";"Ropczyce";"rural area in urban-rural commune";"1";"Zespół Szkół w Ropczycach, ul. Mickiewicza 14, Ropczyce";"General";"No";"ulice: Dębowa, Konopnickiej, Korczaka, Lisa Kuli, Masarska numery nieparzyste od nr 1 do końca i numery parzyste od nr 2 do nr 28, Mickiewicza numery nieparzyste od nr 1 do nr 93 i numery parzyste od nr 2 do nr 70, Najświętszej Marii Panny, Sportowa, Topolowa, Wierzbowe Miasto, Witosa numery nieparzyste od nr 1 do nr 15 i numery parzyste od nr  2 do nr 22, Wyspiańskiego, Viscardiego"
