"Electoral institution";"Teritorial code";"Constituency no";"Mandates quantity";"Committees quantity";"Candidates quantity";"Electorals quantity";"Constituency boundaries"
"Sejmik Województwa Podkarpackiego";"180000";"1";"7";"9";"96";"384180";"m. Rzeszów; pow. leżajski; pow. łańcucki; pow. rzeszowski"
"Sejmik Województwa Podkarpackiego";"180000";"2";"6";"8";"84";"321811";"pow. dębicki; pow. mielecki; pow. ropczycko-sędziszowski; pow. strzyżowski"
"Sejmik Województwa Podkarpackiego";"180000";"3";"6";"9";"91";"276598";"m. Tarnobrzeg; pow. kolbuszowski; pow. niżański; pow. stalowowolski; pow. tarnobrzeski"
"Sejmik Województwa Podkarpackiego";"180000";"4";"6";"8";"80";"319448";"m. Przemyśl; pow. jarosławski; pow. lubaczowski; pow. przemyski; pow. przeworski"
"Sejmik Województwa Podkarpackiego";"180000";"5";"8";"9";"108";"391451";"m. Krosno; pow. bieszczadzki; pow. brzozowski; pow. jasielski; pow. krośnieński; pow. leski; pow. sanocki"
"Rada Powiatu w Ustrzykach Dolnych";"180100";"1";"6";"4";"48";"7973";"miasto Ustrzyki Dolne"
"Rada Powiatu w Ustrzykach Dolnych";"180100";"2";"6";"4";"46";"6455";"gmina Ustrzyki Dolne (teren wiejski)"
"Rada Powiatu w Ustrzykach Dolnych";"180100";"3";"3";"4";"24";"3721";"gminy: Czarna, Lutowiska"
"Rada Powiatu w Brzozowie";"180200";"1";"8";"6";"72";"21119";"gmina Brzozów"
"Rada Powiatu w Brzozowie";"180200";"2";"5";"6";"54";"13474";"gminy: Dydnia, Nozdrzec"
"Rada Powiatu w Brzozowie";"180200";"3";"6";"6";"54";"18027";"gminy: Domaradz, Haczów, Jasienica Rosielna"
"Rada Powiatu Dębickiego";"180300";"1";"9";"6";"85";"38507";"Miasto Dębica"
"Rada Powiatu Dębickiego";"180300";"2";"3";"6";"26";"14602";"Gmina Brzostek, Gmina Jodłowa"
"Rada Powiatu Dębickiego";"180300";"3";"5";"6";"46";"20522";"Gmina Czarna, Gmina Żyraków"
"Rada Powiatu Dębickiego";"180300";"4";"5";"6";"43";"19191";"Gmina Dębica"
"Rada Powiatu Dębickiego";"180300";"5";"3";"6";"29";"13792";"Gmina Pilzno"
"Rada Powiatu Jarosławskiego";"180400";"1";"8";"6";"78";"32375";"Miasto Jarosław"
"Rada Powiatu Jarosławskiego";"180400";"2";"6";"4";"48";"24624";"Gminy: Wiązownica, Laszki, Jarosław"
"Rada Powiatu Jarosławskiego";"180400";"3";"5";"5";"48";"17975";"Miasto Radymno, Gminy: Radymno, Chłopice"
"Rada Powiatu Jarosławskiego";"180400";"4";"6";"5";"51";"22681";"Gminy: Roźwienica, Rokietnica, Pruchnik. Pawłosiów"
"Rada Powiatu w Jaśle";"180500";"1";"7";"4";"56";"30748";"gmina miejska Jasło"
"Rada Powiatu w Jaśle";"180500";"2";"3";"4";"23";"12986";"gmina wiejska Jasło"
"Rada Powiatu w Jaśle";"180500";"3";"6";"4";"42";"21978";"gminy: Brzyska, Kołaczyce, Skołyszyn"
"Rada Powiatu w Jaśle";"180500";"4";"3";"4";"23";"10985";"gminy: Dębowiec, Osiek Jasielski"
"Rada Powiatu w Jaśle";"180500";"5";"4";"4";"29";"16597";"gminy: Krempna, Nowy Żmigród, Tarnowiec"
"Rada Powiatu w Kolbuszowej";"180600";"1";"8";"4";"61";"19976";"Okręg wyborczy Nr 1 - miasto i gmina Kolbuszowa"
"Rada Powiatu w Kolbuszowej";"180600";"2";"4";"3";"17";"11824";"Okręg wyborczy Nr 2 - Gmina Raniżów i Gmina Cmolas"
"Rada Powiatu w Kolbuszowej";"180600";"3";"4";"3";"23";"9744";"Okręg wyborczy Nr 3 - Gmina Dzikowiec i Gmina Niwiska"
"Rada Powiatu w Kolbuszowej";"180600";"4";"3";"4";"22";"7760";"Okręg wyborczy Nr 4 - Gmina Majdan Królewski"
"Rada Powiatu Krośnieńskiego";"180700";"1";"3";"6";"28";"10538";"gmina Chorkówka"
"Rada Powiatu Krośnieńskiego";"180700";"2";"3";"7";"32";"13417";"gmina Dukla, gmina Jaśliska"
"Rada Powiatu Krośnieńskiego";"180700";"3";"6";"7";"59";"21211";"gminy: Iwonicz-Zdrój, Rymanów"
"Rada Powiatu Krośnieńskiego";"180700";"4";"3";"7";"35";"12466";"gmina Jedlicze"
"Rada Powiatu Krośnieńskiego";"180700";"5";"4";"6";"39";"16182";"gminy: Korczyna, Wojaszówka"
"Rada Powiatu Krośnieńskiego";"180700";"6";"4";"6";"34";"14933";"gminy: Krościenko Wyżne, Miejsce Piastowe"
"Rada Powiatu Leżajskiego";"180800";"1";"4";"7";"52";"11875";"Gmina Miasto Leżajsk"
"Rada Powiatu Leżajskiego";"180800";"2";"4";"6";"43";"11134";"Gmina Grodzisko Dolne, Gmina Kuryłówka"
"Rada Powiatu Leżajskiego";"180800";"3";"5";"7";"62";"15534";"Gmina Leżajsk"
"Rada Powiatu Leżajskiego";"180800";"4";"6";"7";"73";"17130";"Miasto i Gmina Nowa Sarzyna"
"Rada Powiatu w Lubaczowie";"180900";"1";"4";"6";"48";"10402";"Miasto Lubaczów"
"Rada Powiatu w Lubaczowie";"180900";"2";"7";"6";"74";"19539";"Gmina Lubaczów, Gmina Oleszyce, Gmina Stary Dzików, Gmina Wielkie Oczy"
"Rada Powiatu w Lubaczowie";"180900";"3";"6";"6";"62";"17051";"Gmina Cieszanów, Gmina Horyniec-Zdrój, Gmina Narol"
"Rada Powiatu Łańcuckiego";"181000";"1";"4";"6";"44";"14608";"Miasto Łańcut"
"Rada Powiatu Łańcuckiego";"181000";"2";"7";"6";"67";"21611";"Gmina Łańcut, Gmina Markowa"
"Rada Powiatu Łańcuckiego";"181000";"3";"4";"7";"44";"11783";"Gmina Białobrzegi, Gmina Żołynia"
"Rada Powiatu Łańcuckiego";"181000";"4";"4";"5";"33";"14283";"Gmina Czarna, Gmina Rakszawa"
"Rada Powiatu Mieleckiego";"181100";"1";"6";"6";"62";"27380";"miasto Mielec, osiedla: Rzochów, Wojsław, Kilińskiego, Kościuszki, Lotników, Borek, część osiedla Cyranka, Niepodległości, Żeromskiego, Wolności, Kazimierza Wielkiego"
"Rada Powiatu Mieleckiego";"181100";"2";"5";"5";"46";"23414";"miasto Mielec, osiedla: Kopernika, Kusocińskiego, część osiedla Cyranka, Mościska, Szafera, Dziubków, Smoczka I, Smoczka II "
"Rada Powiatu Mieleckiego";"181100";"3";"4";"4";"30";"16309";"miasto i gmina Radomyśl Wielki, , gmina Wadowice Górne"
"Rada Powiatu Mieleckiego";"181100";"4";"5";"6";"48";"22411";"gmina Borowa, gmina Czermin, gmina Gawłuszowice, gmina Padew Narodowa, gmina Tuszów Narodowy"
"Rada Powiatu Mieleckiego";"181100";"5";"5";"6";"49";"18712";"gmina Mielec, gmina Przecław"
"Rada Powiatu Niżańskiego";"181200";"1";"3";"4";"24";"8562";"Gmina Harasiuki i Gmina Krzeszów"
"Rada Powiatu Niżańskiego";"181200";"2";"4";"5";"40";"11430";"Gmina Ulanów i Gmina Jarocin"
"Rada Powiatu Niżańskiego";"181200";"3";"3";"5";"28";"7640";"Gmina Jeżowe"
"Rada Powiatu Niżańskiego";"181200";"4";"6";"6";"71";"18180";"Gmina Nisko"
"Rada Powiatu Niżańskiego";"181200";"5";"3";"7";"39";"8368";"Gmina Rudnik nad Sanem"
"Rada Powiatu Przemyskiego";"181300";"1";"3";"7";"38";"7684";"Gmina Dubiecko"
"Rada Powiatu Przemyskiego";"181300";"2";"3";"7";"41";"9338";"Gmina Bircza, Gmina Krzywcza"
"Rada Powiatu Przemyskiego";"181300";"3";"5";"8";"73";"15942";"Gmina Krasiczyn, Gmina Przemyśl, Gmina Fredropol"
"Rada Powiatu Przemyskiego";"181300";"4";"5";"7";"66";"16808";"Gmina Żurawica, Gmina Orły"
"Rada Powiatu Przemyskiego";"181300";"5";"3";"6";"36";"8170";"Gmina Medyka, Gmina Stubno"
"Rada Powiatu Przeworskiego";"181400";"1";"3";"4";"21";"8859";"Gminy: Adamówka, Sieniawa"
"Rada Powiatu Przeworskiego";"181400";"2";"6";"6";"63";"18020";"Gminy: Tryńcza, Przeworsk"
"Rada Powiatu Przeworskiego";"181400";"3";"4";"6";"46";"13089";"Miasto Przeworsk"
"Rada Powiatu Przeworskiego";"181400";"4";"3";"5";"24";"9375";"Gminy: Gać, Zarzecze"
"Rada Powiatu Przeworskiego";"181400";"5";"5";"6";"54";"14124";"Gminy: Kańczuga, Jawornik Polski"
"Rada Powiatu Ropczycko-Sędziszowskiego";"181500";"1";"7";"6";"77";"20899";"Gmina Ropczyce"
"Rada Powiatu Ropczycko-Sędziszowskiego";"181500";"2";"6";"5";"58";"18488";"Gmina Sędziszów Małopolski"
"Rada Powiatu Ropczycko-Sędziszowskiego";"181500";"3";"6";"6";"61";"17826";"Gminy: Iwierzyce, Ostrów, Wielopole Skrzyńskie"
"Rada Powiatu w Rzeszowie";"181600";"1";"4";"4";"26";"18374";"gmina Sokołów Młp., gmina Kamień"
"Rada Powiatu w Rzeszowie";"181600";"2";"3";"5";"25";"14321";"gmina Głogów Młp., "
"Rada Powiatu w Rzeszowie";"181600";"3";"5";"4";"32";"23216";"gmina Trzebownisko, gmina Krasne"
"Rada Powiatu w Rzeszowie";"181600";"4";"3";"4";"21";"12358";"gmina Świlcza"
"Rada Powiatu w Rzeszowie";"181600";"5";"4";"4";"23";"14854";"gmina Boguchwała"
"Rada Powiatu w Rzeszowie";"181600";"6";"3";"5";"23";"13732";"gmina Tyczyn, gmina Lubenia"
"Rada Powiatu w Rzeszowie";"181600";"7";"3";"4";"23";"13609";"gmina Chmielnik, gmina Błażowa"
"Rada Powiatu w Rzeszowie";"181600";"8";"4";"4";"24";"16073";"miasto Dynów, gmina Dynów, gmina Hyżne"
"Rada Powiatu Sanockiego";"181700";"1";"4";"10";"67";"15117";"gminy: Besko, Bukowsko, Zarszyn"
"Rada Powiatu Sanockiego";"181700";"2";"4";"10";"69";"14702";"gminy: Komańcza, Zagórz"
"Rada Powiatu Sanockiego";"181700";"3";"9";"10";"153";"32462";"gmina miejska Sanok"
"Rada Powiatu Sanockiego";"181700";"4";"4";"10";"74";"15158";"gminy: Sanok (gmina wiejska), Tyrawa Wołoska"
"Rada Powiatu Stalowowolskiego";"181800";"1";"9";"4";"72";"33743";"Osiedle Charzewice , ulice: Brandwicka nr 3-119, 119a /nieparzyste/, 40-164a /parzyste/, Brzozowa, Dolina, Grochowa, Jaśminowa, Karnaty, Kopernika nr 2-12 /parzyste/, Kusińskiego,  Kusocińskiego nr 25-41 /nieparzyste/, 46-88 /parzyste/, Lipowa, Modrzewiowa, Mostowa, Ogrodowa, Owocowa, Parkowa, Polna nr 17-77, Posanie, Pogodna, Przedwiośnie, Retmańska, Rolna, Różana, Rzeczna, Sandomierska, Składowa, Siedliska, Sochy, Starowiejska, Świerkowa, Topolowa, Torowa, Wodna, Wspólna, Ziołowa, Żurawia., Osiedle Rozwadów , ulice: Batorego, St. Bełżyńskiego, Brandwicka nr 2-34c /parzyste/, Broniewskiego, Dąbrowskiego, Graniczna, Grunwaldzka, mjr Hubala, Jagiellońska, Klasztorna, Kochana, Kochanowskiego, Konopnickiej, Kopernika , nr 3-11 /nieparzyste/, Kościuszki, 3 Maja, Matejki, , Mieszka I, Nowowiejskiego, Orkana, Polna nr 1-15, Poprzeczna, Reja, Rozwadowska, Rynek, Sobieskiego, Szewska, Braci Szumielewiczów, Ks. Ściegiennego, Targowa, Wiśniowa, Witosa, Zacisze, Zielona, Osiedle Piaski , ulice: Chmielna, B. Chrobrego, M. Dąbrowskiej, Dębowa, Franciszkańska, A. Fredry, Głogowa, B. Głowackiego, Karpacka, Kasztanowa, Konwaliowa, J. Korczaka, Krasickiego, Krokusowa, Kusocińskiego nr 1a, 1c, 3, 5, 7, 8, 9, 10-21, 22, 23, 24, 26, 28, 30, 32, 36, 36a, 38, 42a, 44a, 45, Monte Cassino, Morelowa, Orzechowa, Piastowska, E.Platter, Poziomkowa, Sikorskiego, ppor. T. Sochy, Stokrotki, Traugutta, 1000-lecia, Kazimierza Wielkiego, , Osiedle Piaski II, ulice: Bratkowa, Cyprysowa, Jałowcowa, Jodłowa, Niemena, Sasankowa, Osiedle Widok, ulice: Cicha, Chopina nr 1-27 /nieparzyste/, Czwartaków, Górka, Harcerska, Klonowa, Kołłątaja, 11 Listopada nr 2, 4-26a, Moniuszki, Niemcewicza, Ogińskiego, Okrężna, Paderewskiego, Piaskowa, Al. Jana Pawła II nr 29, 31, 33, , 35, 45, 47, 49, 77, 116, 118, 122, 124, 126, 128, 130, 132, 134, 136, 138, 140, 142, 144, 146, 148, Przemysłowa nr 10, Szymanowskiego, Wieniawskiego , Osiedle Młodynie:, ulice: 11 Listopada nr 1, 3, Obr. Pokoju, Obr. Westerplatte, Wojska Polskiego, KEN nr 8, 10, 14, Gen. Okulickiego nr 40, 42, 44, 46, 48, 50, 52, 54, 56, 56a, 56b, 77, 85, 87, 89, 91, 93, 95, 97, 99, 101, 103, 105, 107, 109, 111, 113, 116, 117, 118 119, 120, 121, 122, 126, 128 132, 134, , Osiedle Poręby:, ulice: Chopina nr 2-34a /parzyste/, Al. Jana Pawła II nr 26, 26a, 26b, 28, 30, 32, 34, 36, 38, 40, 42, 46, 48, 52, 56, 58, 60, 60a-60i, 62, 64, 66, 68, 70, 72, 74, 76, 78, 80, 82, 84, 86, 88, 90, 92, 94, 96, 98, 100, 102, 106, 108, 110, 112, 114, Poniatowskiego nr 41, 41a, 41b, 41c, 41d, 41e, 43, 45, 45a, 47, 49, 51, 53, 55, 57a, 57b, 59, 61, 63, 65, 67, 69, 86, 88, 94, 96, KEN nr 2, 6, , Osiedle Pławo:, ulice: Al. Jana Pawła II nr 2, 2c, 4, 6, 8, 12, 14, 16, 20, 22, 24, Pławo, Poniatowskiego nr 23, 25, 27, 29, 35, 35a, 35b, 37, 39, 66, 68, 68a, 70, 72, 74, 78, 78a, 80, 82, 84, 84a, Popiełuszki nr 4, Wałowa nr 85, 95 , Osiedla: Flisaków i Na Skarpie:, ulica Poniatowskiego nr 2, 3, 5, 6, 7, 9, 10, 11, 12, 13, 15, 17, 17a, 18, 19, 19B, 19H, 20, 21, 21b, 21c, 21g, 22, 24, 26, 28, 32, 34, 36, 38, 40, 42, 44, 46 , Ulice: Boczna, Czajkowskiego, Podgórna, Reymonta, Wałowa nr 1, 2a-2g, 3, 3a, 4a-4g, 5, 7, 8, 14 - 18,  18a, 19-24, 27a, 28, 29, 32-34, 36, 38, 39a, 40-44, 46, 48, 49, 52, 56, 57, 58, 64, 67, 120, Osiedle Centralne:, ulice: Floriańska, Gen. Okulickiego nr 1a, 1b, 1c, 2, 4, 6, 7, 7a, 8, 10, 14, 16, 18, 22, 26, 28, 30, Al. Jana Pawła II nr 1, 3, 7, 9, 13, 13a, 15, 17, 19, 21, 23, KEN nr 3, 5, 9, , Ks. J. Popiełuszki nr 6, 12, 12a, , "
"Rada Powiatu Stalowowolskiego";"181800";"2";"5";"4";"40";"19632";"Osiedle Flisaków:, ulica Czarnieckiego nr 5, 7, 9, 11, 13, , Osiedle Śródmieście:, ulica Czarnieckiego nr 4, 6, 8, 10, 12, 14, Narutowicza , nr 1, 2, 3, 3a, 4, 5, 6, 7, 8, 9, 11, Ks. J. Popiełuszki nr 1, 3, 5, 7, 9, 11, 13, 15, 17a, Staszica nr 2a, 2b, 2c, 3, 3a, 3b, 3c, 5-9, 12, 13, 14, 15, 15a, 15b, 16, 16a, 17, 18, 18a, Pr. S. Wyszyńskiego nr 5, 5a, 7, 7a, 9, 9a, 11, 13, 14, 15, 16, 17, 18, 19, 19a, 21, 21a, 23, 23a, Mickiewicza, Wolności nr 1-6, 8, 10-16, Ks. J.Skoczyńskiego, , Osiedle Lasowiaków:, Ulice: Partyzantów, Gen. Wł. Andersa, B. Chudzyńskiego, Czarnieckiego nr 22, 24, Krzywa, Ossowskiego, Przestrzenna, Skłodowskiej, Trojanowskiego, Wędkarska, Pr. S. Wyszyńskiego nr 2, 4, 4a, 6, 6a, 6b, 8, 8a, 8b, 10, Żwirki i Wigury, Osiedle Zasanie:, ulice: Wiejska, Wiklinowa, Zasanie, Żytnia, Dziubińskiego, Górskiego, Komana, Habdank Kossowskiego, Latawca, Rostka, Sołtysa, Szenklera , Osiedle Energetyków;:ulice: Akacjowa, Chyły, Energetyków, Kwiatowa, Lasowiaków, Makowa, Malinowa, Miła, Słoneczna, Sosnowa, Spacerowa, Spokojna, Szkolna, Swoły, Wąska, Wesoła, Zaułek, Osiedle Hutnik:, ulice: Chodkiewicza, Dąbka, Jagodowa, Koniecpolskiego, Koper, Kossaka, Łąkowa, Parkingowa, Pieńkowskiego, Tarnowskiego, Wańkowicza, Wiśniowieckiego, Wrzosowa, Wyczółkowskiego, Wyspiańskiego, Zamoyskiego, Żółkiewskiego, Osiedla: Fabryczne, Wyzwolenia i Podlesie:, ulice: Bema, Handlowa, Dmowskiego, KEN nr 23, 25, 27, 29, 31, 33-45, Kilińskiego, Komunalna, Niezłomnych, Okrzei, Piwna, Podleśna, 1 Sierpnia, Popiełuszki nr 22, 25, 28, 29, 30, 31, 36, 37, 38, 39, 40, 40a, 40b, 41,  Hutnicza, Metalowców, Ofiar Katynia, Ciemny Kąt, Kwiatkowskiego, PCK, Żeromskiego, Asnyka, Gałczyńskiego, Orzeszkowej,  Przemysłowa nr 1, 1a, 1b, 1c, 3, Siedlanowskiego, Sienkiewicza, Słowackiego, Staffa,  Tuwima, "
"Rada Powiatu Stalowowolskiego";"181800";"3";"4";"4";"31";"14660";"Gmina Radomyśl nad Sanem, Gmina Zaleszany"
"Rada Powiatu Stalowowolskiego";"181800";"4";"5";"4";"34";"20742";"Gmina Bojanów , Gmina Pysznica , Gmina Zaklików"
"Rada Powiatu w Strzyżowie";"181900";"1";"4";"5";"36";"9240";"Gmina Czudec"
"Rada Powiatu w Strzyżowie";"181900";"2";"3";"5";"28";"8261";"Gmina Frysztak"
"Rada Powiatu w Strzyżowie";"181900";"3";"3";"5";"28";"8484";"Gmina Niebylec"
"Rada Powiatu w Strzyżowie";"181900";"4";"6";"5";"53";"17095";"Gmina Strzyżów"
"Rada Powiatu w Strzyżowie";"181900";"5";"3";"6";"35";"6678";"Gmina Wiśniowa"
"Rada Powiatu Tarnobrzeskiego";"182000";"1";"4";"5";"38";"9769";"miasto i gmina Baranów Sandomierski"
"Rada Powiatu Tarnobrzeskiego";"182000";"2";"4";"6";"44";"11023";"gmina Gorzyce"
"Rada Powiatu Tarnobrzeskiego";"182000";"3";"3";"6";"31";"7772";"gmina Grębów"
"Rada Powiatu Tarnobrzeskiego";"182000";"4";"6";"6";"66";"15462";"miasto i gmina Nowa Dęba"
"Rada Powiatu w Lesku";"182100";"1";"3";"4";"20";"4049";"gminy: Baligród, Cisna"
"Rada Powiatu w Lesku";"182100";"2";"6";"4";"43";"9507";"gmina Lesko"
"Rada Powiatu w Lesku";"182100";"3";"3";"4";"20";"4096";"gmina Olszanica"
"Rada Powiatu w Lesku";"182100";"4";"3";"4";"22";"4388";"gmina Solina"
"Rada Miasta Krosna";"186101";"1";"7";"6";"70";"13440";"dzielnice: Śródmieście, Krościenko Niżne, , osiedla: Stefana Grota-Roweckiego, Ks. Bronisława Markiewicza"
"Rada Miasta Krosna";"186101";"2";"7";"5";"56";"13769";"dzielnice: Białobrzegi, Zawodzie, osiedla: Południe, Turaszówka, Tysiąclecia"
"Rada Miasta Krosna";"186101";"3";"7";"5";"57";"11953";"dzielnice: Polanka, Suchodół, osiedle: Traugutta"
"Rada Miejska w Przemyślu";"186201";"1";"7";"7";"94";"17030";"3 Maja strona lewa do nr 33, Andrzeja Kmicica, Armii Krajowej, Artura Malawskiego, Tarska, Bełwińska, Bielskiego, Bieszczadzka, Bolesława Śmiałego, Bpa Jakuba Glazera, Browarna, Bukowa, Cmentarna, Cicha, Długosza, Drzymały, Dubiecka, Dynowska, Felicjanek, Franciszka Dolińskiego, gen. Karaszewicza-Tokarzewskiego, gen. Sikorskiego, gen. Stanisława Maczka, gen. Józefa Wysockiego, gen. Władysława Andersa, Głogowska, Goszczyńskiego, Grunwaldzka, Grzegorza z Sanoka, Henryka Kadyi, Ignacego Daszyńskiego, Ignacego Krasickiego, Jasna, Jesionowa, Kasprowicza, Krakowska, Kraszewskiego, Kremera, Krzywiecka, ks. Ignacego Skorupki, ks. Józefa Poniatowskiego, ks. Piotra Skargi, ks. Stojałowskiego, ks. Brzóski, Legnicka, Lipowicka, Łętowska, Łokietka, Malczewskiego, Marii Curie-Skłodowskiej, Monte Cassino, M. Orłowicza, mjr Słabego, Narutowicza, Norwida, Noskowskiego, O. Augustyna Kordeckiego, Obronna, Obrońców Westerplatte, Onufrego Zagłoby, Ostrowska, Paderewskiego strona prawa od nr 22 do końca, strona lewa cała, Plac Inwalidów Wojennych, Plac Konstytucji 3-go Maja od nr 1 do nr 6, Plac Orląt Przemyskich, Plac Unii Brzeskiej, Płowiecka, ppłk. Kazimierza Gurbiela, Przybyszewskiego, Radosna, Raszyńska, Rzeczna, Wieniawskiego, Rzewuskiego, Salezjańska, Sanatoryjna, Skośna, Skrzetuskiego, Stanisława Sobińskiego, Swobodna, Szańce, Szczęsna, Św. Jana Nepomucena strona prawa cała, strona lewa do nr 33, Św. Józefa, Światowida, Ujejskiego, Węgierska, Władysława Warneńczyka, Wołodyjowskiego, Wróblewskiego, Wyb. Ojca Św. Jana Pawła II, Wyczółkowskiego, Zachariasiewicza, Zakopiańska, Zamiejska, Zawiszy Czarnego, Zofii Chrzanowskiej, Źródlana, Żeromskiego, Żurawicka"
"Rada Miejska w Przemyślu";"186201";"2";"6";"7";"74";"13848";"22 Stycznia, 29 Listopada, 3 Maja strona prawa cała, strona lewa od nr 35 do końca, Astronautów, Barcewicza, Bema, Bolesława Chrobrego, Brodzińskiego, Buszkowicka, Ceramiczna, Chodźki, Czwartaków, Daleka, Dobra, Elżbiety Drużbackiej, Emilii Plater, Gazowa, gen. Chłopickiego, gen. Dwernickiego, gen. Mieczysława Boruty-Spiechowicza, Gliniana, Gościnna, Graniczna, Grenada, Hoża, Idzikowskiego, Iwaszkiewicza, Jabłoniowa, Jana III Sobieskiego, Jordana, Kadłubka, Kazanowska, Klasztorna, Klementyny Hoffmanowej, Kochanowskiego, Kołłątaja, Kordiana, Kosynierów, Koźmiana, Krasińskiego, Langiewicza, Lelewela, Lenartowicza, Małachowskiego, Mireckiego, Mokra, Naruszewicza, Niemcewicza, Obywatelska, Ogrodnicza, Okrzei, Opalińskiego, Ordona, Orkana, Orzeszkowej, Ostrołęcka, Owocowa, Paderewskiego strona prawa do nr 20a, Plac Konstytucji 3 Maja nr 8, płk M.Borelowskiego, Podgórska, Pogodna, Popielów, Prądzyńskiego, Przemyska, Pułaskiego, Racławicka, Rodziewiczówny, Rogozińskiego, Romera, Równa, Sarbiewskiego, Stanisława Augusta, Studencka, Sułkowskiego, Szwoleżerska, Św. Brata Alberta, Św. Jana Nepomucena strona lewa od nr 35 do końca, Tarnowskiego, Tetmajera, Traugutta, Waleriana Kramarza, Wita Stwosza, Wybickiego, Wybrz. Marsz. Ferdynanda Focha, Wyspiańskiego, Wyszyńskiego, Zygmuntowska, Żółkiewskiego, Żulińskiego, Żwirki i Wigury"
"Rada Miejska w Przemyślu";"186201";"3";"5";"8";"68";"11214";"Akacjowa, Aleja XXV Polskiej Drużyny Strzeleckiej, Asnyka, Basztowa, Benszówny, Biblioteczna, Biskupia, Bławatkowa, bpa J. Śnigurskiego, bpa Fischera, bpa J.Pelczara, Brzozowa, Cegielniana, Chocimska, Chodkiewicza, Chopina, Czachowskiego, Czerwieńska, Dojazdowa, Domowa, Dworskiego strona prawa do nr 84, strona lewa do nr 67, Emilii Gierczak, Fabryczna, Franciszkańska, Frankowskiego, Fredry, gen. Stefana Grota–Roweckiego, Głowackiego, Gołębia, Grochowska, Grodzka, Grottgera, Herburtów, Jagiellońska strona lewa, Jarosława Dąbrowskiego, Jarowa, Kamienna, Kapitulna, Karmelicka, Kasztanowa, Katedralna, Kazimierza Wielkiego, Kilińskiego, Komisji Edukacji Narodowej, Kossaka, Kościuszki, Krakusa, Kruhelska, Krzemieniec, ks. J.Federkiewicza, , ks. J. Popiełuszki, ks. Jana Balickiego, Kupały, Kwiatowa, Leśna, Matejki, Michała i Kazimierza Osińskich, Mieszka I, mjr Hubala, mjr Sucharskiego, Moniuszki, Mostowa, Na Zawadach, Niewiadomskiego, O.K.Szykowskiego, Obozowa, Okopowa, Parkowa, Pasteura, Pawia, Piasta Kołodzieja, Piastowska, Pikulicka, Piotra Kmity, Plac Czackiego, Plac Dominikański, Plac im. płk Berka-Joselowicza, Plac im. rotm. Witolda Pileckiego, Plac Katedralny, Plac Na Bramie, Plac Niepodległości, Plac Św. Brunona–Bonifacego, Pod Trzema Krzyżami, Potokowa, Prusa, Przecznica Wałowa, Przemysława, Ptasia, Pusta, Puszkina, Rakoczego, Ratuszowa, Reja, Rejtana strona prawa cała, strona lewa od nr 5 do końca, Rodzinna, Rolnicza, Rosłońskiego, Różana, Rybi Plac, Rynek, Sanocka, Sąsiedzka, Serbańska, Sienkiewicza, Skalna, Słowackiego, Smolki, Sobótki, Stachiewicza, Studzienna, Sucha, Świętej Królowej Jadwigi, Tarnawskiego, Tatarska, Ułańska, Ustronie, Wałowa, Wandy, Waygarta, Witolda Regera, Witoszyńska, Zaułek Wojaka Szwejka, Władycze, Władysława Jagiełły, Wodna, Wyb. Marsz. Józefa Piłsudskiego, Zachodnia, Zaleskiego, Zamkowa, Ziemowita, Złota, Żwirowa"
"Rada Miejska w Przemyślu";"186201";"4";"5";"7";"63";"11300";"6 Pomorskiej Dywizji Piechoty, Bakończycka, Batorego, Bilana, Bogusławskiego, Bohaterów Getta, Brudzewskiego, Budowlanych, Bujaka, Chmielna, Czarnieckiego, Dekerta, Droga Hurecka, Dworskiego strona prawa od nr 86 do końca, strona lewa od nr 69 do końca, Fedkowicza, gen. Henryka Dąbrowskiego, gen. J.Jasińskiego, gen. Leopolda Okulickiego, gen. J.Sowińskiego, Gomółki, Grażyny, Harcerska, Jagiellońska strona prawa, Jana i Jędrzeja Śniadeckich, Józefa Kałuży, Kamienny Most, Kapuścińskiego, Klaczki, Klonowicza, Kokosza, Konarskiego, Konopnickiej, Kopernika, Korzeniowskiego, Koszykowa, Krównicka, Krucza, Krzywa, ks. A.Dobriańskiego, ks. Jana Mogilnickiego, ks. Józefa Ziemiańskiego, Leopolda Hausera, Leszczyńskiego, Lwowska, Łozowa, Łukasiewicza, Łukasińskiego, Mała, Mariacka, Mickiewicza, Mierosławskiego, Miodowa, Młynarska, Mnisza, Nabielaka, Nestora, Niecała, Nowa, Nowowiejskiego, Ofiar Katynia, Okrężna, Orna, Orzechowa, Piaskowa, Plac Legionów, Plac Św. Floriana, Pocztowa, Podhalańczyków, Polna, Północna, Przejazdowa, Przekopana, Przerwa, Rejtana od ul. Dworskiego do ul. A.Mickiewicza tj. od nr 1 do nr 3, Reymonta, Rokitniańska, Rozdroże, Rzeźnicza, Sadowa, Sanowa, Sielecka, Siemiradzkiego, Sienna, Sierakowskiego, Skolimowska, Słoneczna, Smolna, Sportowa, Staszica, Stawowa, Strażacka, Sybiraków, Syrokomli, Szańcowa, Szkolna, Szymanowskiego, Tarniowa, Teofila Wiśniowskiego, Tymona Terleckiego, Topolowa, Trentowskiego, Tuwima, Wapowskiego, Wąska, Wernyhory, Wiarowa, Wiejska, Wierzbowa, Wiklinowa, Wilczańska, Wincentego Pola, Wiśniowa, Wola, Wozowa, Wschodnia, Wspólna, Wybrz. Prezydenta Wilsona, Zacisze, Zaciszna, Zagrodowa, Zamenhoffa, Zamknięta, Zamojskiego, Zana, Zbożowa, Zielińskiego, Zielona, Zyblikiewicza, Żołnierzy I Armii Wojska Polskiego"
"Rada Miasta Rzeszowa";"186301";"1";"7";"7";"85";"38960";"Granica okręgu biegnie granicami administracyjnymi następujących osiedli: Baranówka, Przybyszówka, Franciszka Kotuli, Krakowska Południe, Króla  Augusta, Generała Władysława Andersa, Miłocin."
"Rada Miasta Rzeszowa";"186301";"2";"6";"6";"67";"34390";"Granica okręgu biegnie granicami administracyjnymi następujących osiedli: Staromieście, 1000-Lecia, Śródmieście Północ, Mieszka I, Pobitno, Wilkowyja, Załęże, Słocina."
"Rada Miasta Rzeszowa";"186301";"3";"6";"6";"65";"33247";"Granica okręgu biegnie granicami administracyjnymi następujących osiedli: Śródmieście Południe, Pułaskiego, Kmity, Dąbrowskiego, Piastów, Generała Grota-Roweckiego, Staroniwa , Zwięczyca."
"Rada Miasta Rzeszowa";"186301";"4";"6";"7";"73";"33088";"Granica okręgu biegnie granicami administracyjnymi następujących osiedli: Nowe Miasto, Drabinianka, Zalesie, Paderewskiego, Biała, Budziwój."
"Rada Miasta Tarnobrzeg";"186401";"1";"6";"5";"59";"11582";"Osiedle Serbinów:, , ulice:    Dąbrowskiej, Kwiatkowskiego, Prusa, Orzeszkowej, Gwarków, Jędrusiów, Kanadyjska, Kazimierza Wielkiego, Konstytucji 3 Maja, Kossaka, Królowej Jadwigi, Podleśna,  Skarbka, Sztygarów, Św. Kingi, Matejki, Zwierzyniecka, Sienkiewicza od skrzyżowania z ulicą Sikorskiego do przejazdu kolejowego  – lewa strona numery nieparzyste, Garażowa. , , Osiedle Stare Miasto:, , ulica:     Sikorskiego bloki nr 7, 9, 11, 15, 17, 19., "
"Rada Miasta Tarnobrzeg";"186401";"2";"5";"5";"50";"9758";"Osiedle Dzików:, , ulice:       Czereśniowa, Dzikowska, Freyera, Jabłoniowa, Konfederacji Dzikowskiej, Kwiatowa, Marczaka, Pawłowskiego, Paderewskiego, Polna, Sadowa, Senatora Wiącka, Słomki, Szewery, Tarnowskiego, Wiejska, Warszawska od nr 1 – 99, Ziołowa, Żabia., , Osiedle Stare Miasto:, , ulice:       Dr .Olgii  Lilien,  Jachowicza, Kościuszki nr bl. 24  , i budynki prywatne od nr 2 – 30, Krótka, Plac Bartosza Głowackiego, Przy Zalewie, Sienkiewicza od Placu Bartosza Głowackiego do skrzyżowania z ulicą Sikorskiego nr bl. 4  i budynki prywatne nr 1, 3, 6, 7, 8, 10, 11, 13, 14, 16, 17, 37, 39, 51, Sokola, Szeroka, Szkolna, Dominikańska, Jasińskiego, Nadole, Sandomierska od nr 1 – 28 i 40,  Skrajna, Wałowa, Wyszyńskiego, Żeromskiego., , Osiedle Przywiśle: , , ulice:      Armii Krajowej, Narutowicza, Plac Tysiąclecia, Skalna      ,                Góra, Kosmonautów, Niepodległości, Waryńskiego,   ,                Wianek, Kochanowskiego, Kościuszki nr bl. 31 i  40 , ,                1-go Maja, Mickiewicza nr bl. 14, 16, 38, budynek nr 32 ,                 i 34, Moniuszki, Słowackiego, Wiślna., "
